{
  "$schema": "https://json-schema.org/draft/2020-12/schema",
  "$id": "https://oormanisuddi.local/schemas/edition.schema.json",
  "title": "Edition",
  "description": "One day's news. Each story runs in the one format its `segment` names — ಸುದ್ದಿ ಸಾರ, ಮುಖ್ಯ ಸುದ್ದಿ or ಸ್ಪೀಡ್ ನ್ಯೂಸ್ (D92).",
  "type": "object",
  "required": [
    "stories"
  ],
  "additionalProperties": false,
  "properties": {
    "stories": {
      "type": "array",
      "minItems": 1,
      "maxItems": 16,
      "items": {
        "$ref": "story.schema.json"
      },
      "description": "In priority order. Per-format counts are tokens.Limits (saara_*, roundup_*, mukhya_*)."
    },
    "date": {
      "type": "string",
      "format": "date-time"
    },
    "edition_no": {
      "type": "integer",
      "minimum": 1
    },
    "schema_version": {
      "type": "integer",
      "minimum": 1,
      "description": "The shape of this file. Bumped when a field is added or its meaning changes, so an old edition can be read — or refused — knowingly. Absent means 1."
    },
    "strapline": {
      "type": "string",
      "default": "ಕರಾವಳಿ ಬುಲೆಟಿನ್"
    }
  }
}
