{
  "schema_version": 4,
  "date": "2026-10-08T09:00:00+05:30",
  "edition_no": 1,
  "strapline": "ಕರಾವಳಿ ದಿನಪತ್ರಿಕೆ",
  "stories": [
    {
      "segment": "saara",
      "photo_plan": "",
      "headline": "ಉಪ್ಪುಂದ: ವಿವಾಹ ಪ್ರಸ್ತಾಪ ನಿರಾಕರಿಸಿದ ಯುವತಿ ನಾಪತ್ತೆ, ಪ್ರಕರಣ ದಾಖಲು",
      "category": "crime",
      "deck": "ಬೈಂದೂರು ತಾಲೂಕಿನ ಉಪ್ಪುಂದದ ಖಾಸಗಿ ಸಂಸ್ಥೆ ಉದ್ಯೋಗಿ 23 ವರ್ಷದ ಯುವತಿ ವಿವಾಹ ಪ್ರಸ್ತಾಪ ನಿರಾಕರಿಸಿದ ಬಳಿಕ ನಾಪತ್ತೆಯಾಗಿದ್ದು, ಆತಂಕಗೊಂಡ ಪೋಷಕರು ಬೈಂದೂರು ಠಾಣೆಗೆ ದೂರು ನೀಡಿದ್ದಾರೆ.",
      "points": [
        "ಕೆಲಸಕ್ಕೆ ತೆರಳಿದ ಯುವತಿ ಸಂಜೆಯಾದರೂ ಮರಳಿ ಬಾರದೆ ಮೊಬೈಲ್ ಸಂಪರ್ಕ ಸ್ಥಗಿತಗೊಂಡಿರುವುದರಿಂದ ಕುಟುಂಬಸ್ಥರು ಆತಂಕಗೊಂಡಿದ್ದಾರೆ.",
        "ಸ್ನೇಹಿತರು ಹಾಗೂ ಸಂಬಂಧಿಕರ ಮನೆಗಳಲ್ಲಿ ಶೋಧ ನಡೆಸಿದರೂ ಸುಳಿವು ಪತ್ತೆಯಾಗದ ಹಿನ್ನೆಲೆಯಲ್ಲಿ ಬೈಂದೂರು ಪೊಲೀಸರು ನಾಪತ್ತೆ ಪ್ರಕರಣ ದಾಖಲಿಸಿಕೊಂಡಿದ್ದಾರೆ.",
        "ಯುವತಿಯ ಚಹರೆ ಹಾಗೂ ಭಾವಚಿತ್ರವನ್ನು ಸುತ್ತಮುತ್ತಲಿನ ಠಾಣೆಗಳಿಗೆ ರವಾನಿಸಲಾಗಿದ್ದು, ಮಾಹಿತಿ ದೊರೆತಲ್ಲಿ ಠಾಣೆಗೆ ತಿಳಿಸಲು ಪೊಲೀಸರು ಮನವಿ ಮಾಡಿದ್ದಾರೆ."
      ],
      "takeaway": "ಯುವತಿಯ ಬಗ್ಗೆ ಮಾಹಿತಿ ದೊರೆತಲ್ಲಿ ಸಾರ್ವಜನಿಕರು ತಕ್ಷಣವೇ ಬೈಂದೂರು ಆರಕ್ಷಕ ಠಾಣೆಗೆ ಮಾಹಿತಿ ನೀಡುವಂತೆ ಕೋರಲಾಗಿದೆ.",
      "location": "ಉಪ್ಪುಂದ",
      "sources": [
        "ಉದಯವಾಣಿ"
      ],
      "source_urls": [
        "https://udayavani.com/udupi-news/uppunda-byndoor-missing-woman-employee-police-complaint-396359?lang=kn"
      ],
      "status": "confirmed",
      "published_at": "2026-10-08T09:00:00+05:30",
      "verified_by": "goutham paduvari",
      "verified_at": "2026-10-08T18:03:43+0530"
    },
    {
      "segment": "saara",
      "photo_plan": "",
      "headline": "ಬಂಟ್ವಾಡಿ: ಕಿಂಡಿ ಅಣೆಕಟ್ಟಿಗೆ ಅವಸರದ ಹಲಗೆ, ನೂರಾರು ಎಕರೆ ಗದ್ದೆ ಜಲಾವೃತ",
      "category": "farm",
      "deck": "ಕುಂದಾಪುರ ತಾಲೂಕಿನ ಬಂಟ್ವಾಡಿ ಕಿಂಡಿ ಅಣೆಕಟ್ಟಿಗೆ ಅವಸರದಲ್ಲಿ ಹಲಗೆ ಜೋಡಿಸಿದ್ದರಿಂದ ನದಿಯಲ್ಲಿ ಹಿನ್ನೀರು ಉಕ್ಕಿ ಕೊಯ್ಲಿಗೆ ಬಂದಿದ್ದ ನೂರಾರು ಎಕರೆ ಭತ್ತದ ಗದ್ದೆಗಳಿಗೆ ನುಗ್ಗಿದ್ದು, ರೈತರು ಆಕ್ರೋಶಗೊಂಡಿದ್ದಾರೆ.",
      "points": [
        "ಅಂತರ್ಜಲ ಕುಸಿತದ ಭೀತಿಯಲ್ಲಿ ವಾಡಿಕೆಗಿಂತ ಮುಂಚಿತವಾಗಿಯೇ ಹಲಗೆಗಳನ್ನು ಅಳವಡಿಸಿದ್ದರಿಂದ ಗದ್ದೆಗಳಲ್ಲಿ ನೀರು ನಿಂತು ಫಸಲು ಕೊಳೆಯುವ ಭೀತಿ ಎದುರಾಗಿದೆ.",
        "ಕಷ್ಟಪಟ್ಟು ಬೆಳೆದ ಭತ್ತದ ತೆನೆಗಳು ನೀರಿನಲ್ಲಿ ಮುಳುಗಿರುವುದರಿಂದ ಕಂಗಾಲಾಗಿರುವ ಅನ್ನದಾತರು ಅಧಿಕಾರಿಗಳ ಅವೈಜ್ಞಾನಿಕ ನಿರ್ಧಾರದ ವಿರುದ್ಧ ತೀವ್ರ ಆಕ್ರೋಶ ಹೊರಹಾಕಿದ್ದಾರೆ.",
        "ತಕ್ಷಣವೇ ಹಲಗೆಗಳನ್ನು ತೆರವುಗೊಳಿಸಿ ನೀರು ಹೊರಹಾಕದಿದ್ದರೆ ಹಾಗೂ ಸೂಕ್ತ ಬೆಳೆ ಪರಿಹಾರ ನೀಡದಿದ್ದರೆ ಉಗ್ರ ಹೋರಾಟದ ಎಚ್ಚರಿಕೆ ನೀಡಲಾಗಿದೆ."
      ],
      "takeaway": "ಗದ್ದೆಗಳಲ್ಲಿ ನಿಂತಿರುವ ನೀರು ತೆರವುಗೊಳಿಸಲು ಹಾಗೂ ಹಾನಿಗೊಳಗಾದ ಬೆಳೆಗೆ ಸೂಕ್ತ ಪರಿಹಾರಕ್ಕೆ ರೈತರು ಎಚ್ಚರಿಕೆ ನೀಡಿದ್ದಾರೆ.",
      "location": "ಕುಂದಾಪುರ",
      "sources": [
        "ಉದಯವಾಣಿ"
      ],
      "source_urls": [
        "https://udayavani.com/udupi-news/dam-planks-installed-early-water-inundates-paddy-fields-in-bantwadi-farmers-fear-crop-losses-700591?lang=kn"
      ],
      "status": "confirmed",
      "published_at": "2026-10-08T09:15:00+05:30",
      "verified_by": "goutham paduvari",
      "verified_at": "2026-10-08T18:03:43+0530"
    },
    {
      "segment": "saara",
      "photo_plan": "",
      "headline": "ಹೊಸಂಗಡಿ: ಅಕ್ರಮ ವಿದ್ಯುತ್ ಬೇಲಿ ತಗುಲಿ ಯುವಕ ಮೃತ, ಪ್ರಕರಣ ದಾಖಲು",
      "category": "accident",
      "deck": "ಸಿದ್ದಾಪುರ ಸಮೀಪದ ಹೊಸಂಗಡಿಯಲ್ಲಿ ಕೃಷಿ ತೋಟಕ್ಕೆ ಅಳವಡಿಸಲಾಗಿದ್ದ ಅಕ್ರಮ ವಿದ್ಯುತ್ ಬೇಲಿಯ ತಂತಿ ತಗುಲಿ ಸ್ಥಳೀಯ ಯುವಕ ಸ್ಥಳದಲ್ಲೇ ಮೃತಪಟ್ಟಿದ್ದು, ತೋಟದ ಮಾಲಕರ ವಿರುದ್ಧ ಕ್ರಿಮಿನಲ್ ಪ್ರಕರಣ ದಾಖಲಾಗಿದೆ.",
      "points": [
        "ಕಾಡುಪ್ರಾಣಿಗಳ ಹಾವಳಿ ತಡೆಯುವ ನೆಪದಲ್ಲಿ ತೋಟದ ಮಾಲಕರು ವಿದ್ಯುತ್ ಮಾರ್ಗದಿಂದ ಅಧಿಕ ವೋಲ್ಟೇಜ್ ವಿದ್ಯುತ್ ಹರಿಸಿ ಅಕ್ರಮ ಸಂಪರ್ಕ ಕಲ್ಪಿಸಿದ್ದರು.",
        "ರಸ್ತೆ ಬದಿಯಲ್ಲಿ ನಡೆದು ಹೋಗುತ್ತಿದ್ದ ಯುವಕ ಆಕಸ್ಮಿಕವಾಗಿ ತಂತಿಗೆ ಸ್ಪರ್ಶಿಸಿ ವಿದ್ಯುತ್ ಆಘಾತದಿಂದ ದಾರುಣವಾಗಿ ಪ್ರಾಣ ಕಳೆದುಕೊಂಡಿದ್ದಾನೆ.",
        "ಸಿದ್ದಾಪುರ ಪೊಲೀಸರು ಹಾಗೂ ಮೆಸ್ಕಾಂ ಅಧಿಕಾರಿಗಳು ಸ್ಥಳಕ್ಕೆ ಭೇಟಿ ನೀಡಿದ್ದು, ಜೀವಕ್ಕೆ ಹಾನಿಯುಂಟುಮಾಡುವ ಅಕ್ರಮ ಬೇಲಿ ವಿರುದ್ಧ ಕಠಿಣ ಕ್ರಮಕ್ಕೆ ಆಗ್ರಹಿಸಲಾಗಿದೆ."
      ],
      "takeaway": "ಅಪಾಯಕಾರಿ ಅಕ್ರಮ ವಿದ್ಯುತ್ ಬೇಲಿಗಳ ವಿರುದ್ಧ ಕಠಿಣ ಕಾನೂನು ಕ್ರಮ ಕೈಗೊಳ್ಳುವಂತೆ ಗ್ರಾಮಸ್ಥರು ಒತ್ತಾಯಿಸಿದ್ದಾರೆ.",
      "location": "ಕುಂದಾಪುರ",
      "sources": [
        "ಉದಯವಾಣಿ"
      ],
      "source_urls": [
        "https://udayavani.com/udupi-news/Youth--Due-to-Electric-Shock-in-Hosangadi-788121?lang=kn"
      ],
      "status": "confirmed",
      "published_at": "2026-10-08T09:30:00+05:30",
      "verified_by": "goutham paduvari",
      "verified_at": "2026-10-08T18:03:43+0530"
    },
    {
      "segment": "saara",
      "photo_plan": "",
      "headline": "ಕುಂದಾಪುರ: ಬರಪೀಡಿತ ಪಟ್ಟಿಗೆ ಸೇರಿಸಲು ಆಗ್ರಹಿಸಿ ರೈತರ ಪ್ರತಿಭಟನೆ",
      "category": "farm",
      "deck": "ಬೈಂದೂರು ತಾಲೂಕನ್ನು ಬರಪೀಡಿತ ಎಂದು ಘೋಷಿಸಿ ಕುಂದಾಪುರವನ್ನು ಕೈಬಿಟ್ಟಿರುವುದನ್ನು ಖಂಡಿಸಿ, ತಾಲೂಕನ್ನೂ ಬರ ಪಟ್ಟಿಗೆ ಸೇರಿಸಲು ಆಗ್ರಹಿಸಿ ರೈತ ಮುಖಂಡರು ಹಾಗೂ ಸಂಘಟನೆಗಳು ತೀವ್ರ ಪ್ರತಿಭಟನೆ ನಡೆಸಿವೆ.",
      "points": [
        "ಕುಂದಾಪುರ ತಾಲೂಕಿನಲ್ಲಿ ಈ ಬಾರಿ ಶೇಕಡಾ 45ಕ್ಕೂ ಹೆಚ್ಚು ಮಳೆ ಕೊರತೆಯಾಗಿದ್ದು, ಕೊಯ್ಲಿಗೆ ಬಂದ ಭತ್ತದ ಬೆಳೆ ಮತ್ತು ಅಡಿಕೆ ತೋಟಗಳು ಒಣಗುತ್ತಿವೆ.",
        "ವಾರಾಹಿ ನದಿಯ ಮಾಣಿ ಜಲಾಶಯದ ನೀರಿನ ಸಂಗ್ರಹ ಕುಸಿದಿದ್ದರೂ ದೋಷಪೂರಿತ ಮಳೆಮಾಪನ ಅಂಕಿಅಂಶಗಳಿಂದ ತಾಲೂಕನ್ನು ಕೈಬಿಡಲಾಗಿದೆ ಎಂದು ರೈತರು ಆರೋಪಿಸಿದ್ದಾರೆ.",
        "ವಾಸ್ತವ ಬೆಳೆಹಾನಿ ಸಮೀಕ್ಷೆ ನಡೆಸಿ ಬರ ಪರಿಹಾರ ಹಾಗೂ ಕುಡಿಯುವ ನೀರಿನ ವಿಶೇಷ ಅನುದಾನ ಮಂಜೂರು ಮಾಡಲು ಜಿಲ್ಲಾಡಳಿತಕ್ಕೆ ಮನವಿ ಸಲ್ಲಿಸಲಾಗಿದೆ."
      ],
      "takeaway": "ವಾಸ್ತವ ಬೆಳೆಹಾನಿ ಸಮೀಕ್ಷೆ ನಡೆಸಿ ತಕ್ಷಣವೇ ಬರ ಪರಿಹಾರ ಹಾಗೂ ಅನುದಾನ ಮಂಜೂರು ಮಾಡಲು ರೈತರು ಆಗ್ರಹಿಸಿದ್ದಾರೆ.",
      "location": "ಕುಂದಾಪುರ",
      "sources": [
        "ಉದಯವಾಣಿ"
      ],
      "source_urls": [
        "https://udayavani.com/udupi-news/demand-to-include-kundapura-in-drought-hit-list-amid-severe-crop-damage-and-rainfall-deficit-475855?lang=kn"
      ],
      "status": "confirmed",
      "published_at": "2026-10-08T09:45:00+05:30",
      "verified_by": "goutham paduvari",
      "verified_at": "2026-10-08T18:03:43+0530"
    },
    {
      "segment": "saara",
      "photo_plan": "",
      "headline": "ಕುಂದಾಪುರ-ಬೈಂದೂರು: 6 ಪ್ರಮುಖ ಸೇತುವೆ ನಿರ್ಮಾಣಕ್ಕೆ ಆಡಳಿತಾತ್ಮಕ ಅನುಮೋದನೆ",
      "category": "civic",
      "deck": "ಕುಂದಾಪುರ ಮತ್ತು ಬೈಂದೂರು ವ್ಯಾಪ್ತಿಯ ನದಿ ಪಾತ್ರದ ದ್ವೀಪ ಪ್ರದೇಶಗಳನ್ನು ಮುಖ್ಯ ಹೆದ್ದಾರಿಗೆ ಬೆಸೆಯುವ 6 ಪ್ರಮುಖ ಸೇತುವೆಗಳ ಕಾಮಗಾರಿಗೆ ಆಡಳಿತಾತ್ಮಕ ಅನುಮೋದನೆ ದೊರೆತಿದ್ದು, ಟೆಂಡರ್ ಪ್ರಕ್ರಿಯೆ ಚುರುಕುಗೊಂಡಿದೆ.",
      "points": [
        "ಸೌಪರ್ಣಿಕಾ, ಚಕ್ರಾ ಹಾಗೂ ವಾರಾಹಿ ನದಿಗಳ ಹಿನ್ನೀರಿನ ನಡುಗಡ್ಡೆ ಪ್ರದೇಶಗಳ ಗ್ರಾಮಸ್ಥರು ಮಳೆಗಾಲದಲ್ಲಿ ದೋಣಿಗಳಲ್ಲಿ ಸಂಚರಿಸುವ ಅಪಾಯ ತಪ್ಪಿಸಲು ಯೋಜನೆ ರೂಪಿಸಲಾಗಿದೆ.",
        "ದಶಕಗಳಿಂದ ಬಾಕಿ ಉಳಿದಿದ್ದ ಸೇತುವೆಗಳಿಂದ ಆಸ್ಪತ್ರೆ, ಶಾಲೆ, ಮಾರುಕಟ್ಟೆ ಸಂಪರ್ಕ ಸುಲಭವಾಗಲಿದ್ದು, ಪ್ರವಾಸೋದ್ಯಮ ಮತ್ತು ಮೀನುಗಾರಿಕೆ ಸಾಗಣೆಗೆ ವೇಗ ಸಿಗಲಿದೆ.",
        "ತಾಂತ್ರಿಕ ಮೌಲ್ಯಮಾಪನ ಮುಗಿಸಿ ಹಿಂಗಾರು ಅವಧಿಯಲ್ಲೇ ನದಿ ತಳಪಾಯದ ಕಾಮಗಾರಿ ಆರಂಭಿಸಲು ಎಂಜಿನಿಯರ್ಗಳಿಗೆ ಕಟ್ಟುನಿಟ್ಟಿನ ಸೂಚನೆ ನೀಡಲಾಗಿದೆ."
      ],
      "takeaway": "ಹಿಂಗಾರು ಅವಧಿಯಲ್ಲೇ ನದಿ ತಳಪಾಯದ ಕಾಮಗಾರಿ ಆರಂಭಿಸಲು ಲೋಕೋಪಯೋಗಿ ಇಲಾಖೆ ಸೂಚನೆ ನೀಡಿದೆ.",
      "location": "ಕುಂದಾಪುರ",
      "sources": [
        "ಉದಯವಾಣಿ"
      ],
      "source_urls": [
        "https://udayavani.com/udupi-news/construction-of-six-major-bridges-on-the-coast-accelerated-687864?lang=kn"
      ],
      "status": "confirmed",
      "published_at": "2026-10-08T10:00:00+05:30",
      "verified_by": "goutham paduvari",
      "verified_at": "2026-10-08T18:03:43+0530"
    },
    {
      "segment": "saara",
      "photo_plan": "",
      "headline": "ಕರಾವಳಿ: ಹೈನುಗಾರರಿಗೆ ಹಸಿರು ಮೇವಿನ ಬಿತ್ತನೆ ಬೀಜ ವಿತರಣೆ ವಿಳಂಬ, ಆಕ್ರೋಶ",
      "category": "farm",
      "deck": "ಕರಾವಳಿ ಜಿಲ್ಲಾದ್ಯಂತ ಭೀಕರ ಮುಂಗಾರು ಕೊರತೆ ಆವರಿಸಿದ್ದರೂ, ಬೈಂದೂರು, ಕುಂದಾಪುರ ಹಾಗೂ ಬ್ರಹ್ಮಾವರ ತಾಲೂಕುಗಳ ಹೈನುಗಾರರಿಗೆ ರಿಯಾಯಿತಿ ದರದ ಹಸಿರು ಮೇವಿನ ಬೀಜಗಳು ವಿತರಣೆಯಾಗದೆ ಉಳಿದಿರುವುದು ಆಕ್ರೋಶಕ್ಕೆ ಕಾರಣವಾಗಿದೆ.",
      "points": [
        "ಕಡುಬಿಸಿಲಿಗೆ ಗ್ರಾಮೀಣ ಗೋಮಾಳಗಳು ಒಣಗಿದ್ದು, ಹಿಂಗಾರಿನಲ್ಲಿ ಬೆಳೆಸಲು ಬೀಜಗಳು ಸಿಗದೆ ರೈತರು ದುಬಾರಿ ಬೆಲೆ ತೆತ್ತು ಖಾಸಗಿ ಮಾರುಕಟ್ಟೆಯಲ್ಲಿ ಒಣಮೇವು ಖರೀದಿಸುತ್ತಿದ್ದಾರೆ.",
        "ಮೇವಿನ ಕೊರತೆಯಿಂದ ಸಹಕಾರಿ ಸಂಘಗಳಲ್ಲಿ ಹಾಲಿನ ಸಂಗ್ರಹ ಗಣನೀಯವಾಗಿ ಇಳಿಮುಖವಾಗುತ್ತಿದ್ದು, ಗ್ರಾಮೀಣ ಕುಟುಂಬಗಳು ತೀವ್ರ ನಷ್ಟ ಎದುರಿಸುತ್ತಿವೆ.",
        "ರೈತ ಸಂಪರ್ಕ ಕೇಂದ್ರಗಳ ಮೂಲಕ ಮೇವಿನ ಮಿನಿಕಿಟ್ಗಳನ್ನು ತಕ್ಷಣವೇ ಹಂಚಿಕೆ ಮಾಡಿ, ಬರಪೀಡಿತ ಹಳ್ಳಿಗಳಲ್ಲಿ ತುರ್ತು ಮೇವಿನ ಡಿಪೋ ತೆರೆಯಲು ಆಗ್ರಹಿಸಲಾಗಿದೆ."
      ],
      "takeaway": "ಬರಪೀಡಿತ ಹಳ್ಳಿಗಳಲ್ಲಿ ತುರ್ತು ಮೇವಿನ ಡಿಪೋಗಳನ್ನು ತೆರೆಯುವಂತೆ ಹೈನುಗಾರರ ಸಂಘಟನೆಗಳು ಒತ್ತಾಯಿಸಿವೆ.",
      "location": "ಬೈಂದೂರು",
      "sources": [
        "ಉದಯವಾಣಿ"
      ],
      "source_urls": [
        "https://udayavani.com/udupi-news/fodder-for-farmers-livestock-fodder-seeds-yet-to-be-distributed-698078?lang=kn"
      ],
      "status": "confirmed",
      "published_at": "2026-10-08T10:15:00+05:30",
      "verified_by": "goutham paduvari",
      "verified_at": "2026-10-08T18:03:43+0530"
    }
  ]
}
