{
  "date": "2026-09-25T08:00:00+05:30",
  "edition_no": 1,
  "strapline": "ಕರಾವಳಿ ದಿನಪತ್ರಿಕೆ",
  "stories": [
    {
      "headline": "ಶಾರ್ಜಾದಲ್ಲಿ ಕುಂದಾಪುರದ ವ್ಯಕ್ತಿ ಕೊಲೆ ಆರೋಪ: ಎಸ್ಪಿ ಬಳಿ ತನಿಖೆಗೆ ಮನವಿ",
      "reel_line": "ಶಾರ್ಜಾದಲ್ಲಿ ಕೊಲೆ ಆರೋಪ: ತನಿಖೆಗೆ ಎಸ್ಪಿ ಬಳಿ ಮನವಿ",
      "category": "crime",
      "deck": "ಕುಂದಾಪುರದ ಆಲ್ವಿನ್ ಪ್ರಕಾಶ್ ಶಾರ್ಜಾದಲ್ಲಿ ಕೊಲೆಯಾದ ಶಂಕೆ ವ್ಯಕ್ತವಾಗಿದ್ದು, ತಾಯ್ನಾಡಿಗೆ ಪಾರ್ಥಿವ ಶರೀರ ತರಲು ಹಾಗೂ ನ್ಯಾಯಕ್ಕಾಗಿ ಮೃತರ ಸಹೋದರ ಉಡುಪಿ ಎಸ್ಪಿ ಹರಿರಾಮ್ ಶಂಕರ್‌ಗೆ ಲಿಖಿತ ಮನವಿ ಸಲ್ಲಿಸಿದ್ದಾರೆ.",
      "points": [
        "ಕಳೆದ 14 ವರ್ಷಗಳಿಂದ ಶಾರ್ಜಾ ವಿಮಾನ ನಿಲ್ದಾಣದಲ್ಲಿ ಉದ್ಯೋಗದಲ್ಲಿದ್ದ ಆಲ್ವಿನ್ ಜುಲೈ 20ರಿಂದ ನಾಪತ್ತೆಯಾಗಿದ್ದರು.",
        "ಒಮಾನ್ ಗಡಿ ರಸ್ತೆಯ ವಾಹನದಲ್ಲಿ 2 ಚೀಲಗಳಲ್ಲಿ 9 ತುಂಡುಗಳಾಗಿ ಕತ್ತರಿಸಲ್ಪಟ್ಟ ಕಳೇಬರ ಪತ್ತೆಯಾಗಿದೆ ಎಂದು ತಿಳಿದುಬಂದಿದೆ.",
        "ದುಬೈ ಭಾರತೀಯ ರಾಯಭಾರ ಕಚೇರಿ ಹಾಗೂ ಇಂಟರ್‌ಪೋಲ್ ನೆರವಿನೊಂದಿಗೆ ಮಾಹಿತಿ ಕಲೆಹಾಕಲಾಗುವುದು ಎಂದು ಎಸ್ಪಿ ತಿಳಿಸಿದ್ದಾರೆ."
      ],
      "reel_points": [
        "14 ವರ್ಷಗಳಿಂದ ಶಾರ್ಜಾದಲ್ಲಿದ್ದ ಆಲ್ವಿನ್ ಜುಲೈ 20ರಿಂದ ನಾಪತ್ತೆ",
        "ಒಮಾನ್ ಗಡಿ ರಸ್ತೆಯ ವಾಹನದಲ್ಲಿ ಕಳೇಬರ ಪತ್ತೆಯಾದ ಶಂಕೆ",
        "ದುಬೈ ರಾಯಭಾರ ಕಚೇರಿ ಹಾಗೂ ಇಂಟರ್‌ಪೋಲ್ ಸಂಪರ್ಕ: ಎಸ್ಪಿ"
      ],
      "location": "ಕುಂದಾಪುರ",
      "sources": [
        "ದಾಯ್ಜಿವರ್ಲ್ಡ್"
      ],
      "source_urls": [
        "https://www.daijiworld.com/news/newsDisplay?newsID=1326611"
      ],
      "status": "developing",
      "is_reel": false,
      "photo": {
        "path": "assets/daily/2026-09-25/alwin_kunder_police_sp_investigation.jpg",
        "nature": "ai",
        "credit": "ಊರ್ಮನಿ ಸುದ್ದಿ",
        "licence": "own",
        "caption": "ಉಡುಪಿ ಜಿಲ್ಲಾ ಪೊಲೀಸ್ ವರಿಷ್ಠಾಧಿಕಾರಿ ಕಚೇರಿಯಲ್ಲಿ ತನಿಖಾ ಕಡತಗಳ ಪರಿಶೀಲನೆ"
      },
      "verified_by": "Gautam Paduvari",
      "verified_at": "2026-09-25T15:51:46+0530"
    },
    {
      "headline": "ಕರಾವಳಿಯಲ್ಲಿ ಶೇ.29ರಷ್ಟು ಮಳೆ ಕೊರತೆ: ಸುಡುಬಿಸಿಲಿಗೆ ಒಣಗುತ್ತಿದೆ ಭತ್ತದ ಬೆಳೆ",
      "reel_line": "ಕರಾವಳಿಯಲ್ಲಿ ಶೇ.29 ಮಳೆ ಕೊರತೆ; ಭತ್ತದ ಬೆಳೆ ಹಾನಿ",
      "category": "farm",
      "deck": "ಎಲ್ ನಿನೋ ಪರಿಣಾಮ ಕರಾವಳಿಯಲ್ಲಿ ಶೇ.29ರಷ್ಟು ಭಾರಿ ಮಳೆ ಕೊರತೆ ಉಂಟಾಗಿದ್ದು, ಕಟಾವಿನ ಹಂತದಲ್ಲಿರುವ ಭತ್ತದ ಗದ್ದೆಗಳು ಸುಡುಬಿಸಿಲಿನಿಂದ ಒಣಗುತ್ತಿರುವುದು ಬೈಂದೂರು, ಕುಂದಾಪುರ ಸೇರಿ ಜಿಲ್ಲೆಯ ರೈತರನ್ನು ಆತಂಕಕ್ಕೆ ತಳ್ಳಿದೆ.",
      "points": [
        "ಸೆಪ್ಟೆಂಬರ್ ಅಂತ್ಯಕ್ಕೆ ವಾಡಿಕೆಯ 3,528 ಮಿ.ಮೀ ಬದಲಿಗೆ ಕೇವಲ 2,505.9 ಮಿ.ಮೀ ಮಳೆಯಾಗಿದ್ದು, ಶೇ.29 ಕೊರತೆಯಾಗಿದೆ.",
        "ಮಳೆ ಕೊರತೆಯಿಂದ ಕೃಷಿ ಹೊಂಡ, ಹಳ್ಳ-ಕೊಳ್ಳಗಳಲ್ಲಿ ನೀರು ಕ್ಷೀಣಿಸಿದ್ದು, ತೆನೆ ಕಟ್ಟುವ ಹಂತದಲ್ಲೇ ಗದ್ದೆಗಳು ಒಣಗುತ್ತಿವೆ.",
        "ಕಂದಾಯ ಮತ್ತು ಕೃಷಿ ಇಲಾಖೆ ಜಂಟಿ ಸಮೀಕ್ಷೆ ನಡೆಸಿ ಬೆಳೆ ನಷ್ಟ ಪರಿಹಾರ ನೀಡಬೇಕೆಂದು ಕೃಷಿಕ ಮುಖಂಡರು ಒತ್ತಾಯಿಸಿದ್ದಾರೆ."
      ],
      "reel_points": [
        "ಕರಾವಳಿಯಲ್ಲಿ ವಾಡಿಕೆಗಿಂತ ಶೇ.29ರಷ್ಟು ತೀವ್ರ ಮಳೆ ಕೊರತೆ",
        "ಸುಡುಬಿಸಿಲಿಗೆ ಕಟಾವಿನ ಹಂತದ ಭತ್ತದ ಬೆಳೆ ಒಣಗುವ ಭೀತಿ",
        "ಜಂಟಿ ಸಮೀಕ್ಷೆ ನಡೆಸಿ ಪರಿಹಾರ ಘೋಷಿಸಲು ರೈತರ ಆಗ್ರಹ"
      ],
      "location": "ಬೈಂದೂರು",
      "sources": [
        "ದಾಯ್ಜಿವರ್ಲ್ಡ್"
      ],
      "source_urls": [
        "https://www.daijiworld.com/news/newsDisplay?newsID=1326648"
      ],
      "status": "developing",
      "is_reel": false,
      "photo": {
        "path": "assets/daily/2026-09-25/coastal_paddy_drought_withered_crop.jpg",
        "nature": "ai",
        "credit": "ಊರ್ಮನಿ ಸುದ್ದಿ",
        "licence": "own",
        "caption": "ಮಳೆ ಕೊರತೆ ಹಾಗೂ ಬಿಸಿಲಿನ ತಾಪಕ್ಕೆ ಒಣಗುತ್ತಿರುವ ಭತ್ತದ ಗದ್ದೆ"
      },
      "verified_by": "Gautam Paduvari",
      "verified_at": "2026-09-25T15:51:46+0530"
    },
    {
      "headline": "ಮಣಿಪಾಲ ಆಸ್ಪತ್ರೆ: 15 ದಿನದ ಹಸುಗೂಸಿನ ಮೆದುಳಿನ ಬೃಹತ್ ಗಡ್ಡೆ ಶಸ್ತ್ರಚಿಕಿತ್ಸೆ ಯಶಸ್ವಿ",
      "reel_line": "ಮಣಿಪಾಲ: 15 ದಿನದ ಹಸುಗೂಸಿನ ಮೆದುಳು ಶಸ್ತ್ರಚಿಕಿತ್ಸೆ",
      "category": "health",
      "deck": "ಮಣಿಪಾಲದ ಕಸ್ತೂರ್ಬಾ ಆಸ್ಪತ್ರೆಯ ನರಶಸ್ತ್ರಚಿಕಿತ್ಸಾ ವೈದ್ಯರು ಕೇವಲ 15 ದಿನಗಳ ಹಸುಗೂಸಿನ ಮೆದುಳಿನಲ್ಲಿದ್ದ ಬೃಹತ್ ಗಡ್ಡೆಯನ್ನು ಯಶಸ್ವಿಯಾಗಿ ಶಸ್ತ್ರಚಿಕಿತ್ಸೆ ಮೂಲಕ ಹೊರತೆಗೆದು ಮಗುವಿಗೆ ಹೊಸ ಜೀವ ನೀಡಿದ್ದಾರೆ.",
      "points": [
        "ಅಸಾಮಾನ್ಯ ಗಾತ್ರದ ತಲೆಯೊಂದಿಗೆ ದಾಖಲಾಗಿದ್ದ ನವಜಾತ ಶಿಶುವಿನ ಮೆದುಳಿನಲ್ಲಿ ಗಂಭೀರ ಗಡ್ಡೆ ಇರುವುದು ಪತ್ತೆಯಾಗಿತ್ತು.",
        "ಡಾ. ರಾಘವೇಂದ್ರ ನಾಯಕ್, ಡಾ. ಶೀಲಾ ಮಥಾಯಿ ಹಾಗೂ ಮಕ್ಕಳ ಕ್ಯಾನ್ಸರ್ ತಜ್ಞರ ತಂಡ ಕ್ಲಿಷ್ಟಕರ ಶಸ್ತ್ರಚಿಕಿತ್ಸೆ ನಡೆಸಿದೆ.",
        "ಸಂಪೂರ್ಣ ಗುಣಮುಖವಾಗಿರುವ ಮಗು ಇದೀಗ 3 ವರ್ಷದ ಆರೋಗ್ಯವಂತ ಬಾಲಕನಾಗಿ ಶಾಲೆಗೆ ತೆರಳಲು ಸಜ್ಜಾಗಿದ್ದಾನೆ."
      ],
      "reel_points": [
        "15 ದಿನದ ನವಜಾತ ಶಿಶುವಿನ ಮೆದುಳಿನಲ್ಲಿದ್ದ ಬೃಹತ್ ಗಡ್ಡೆ ಪತ್ತೆ",
        "ಕಸ್ತೂರ್ಬಾ ಆಸ್ಪತ್ರೆ ತಜ್ಞ ವೈದ್ಯರ ತಂಡದಿಂದ ಕ್ಲಿಷ್ಟ ಶಸ್ತ್ರಚಿಕಿತ್ಸೆ",
        "ಗುಣಮುಖವಾದ ಮಗು ಇದೀಗ 3 ವರ್ಷದ ಬಾಲಕನಾಗಿ ಶಾಲೆಗೆ ಸಜ್ಜು"
      ],
      "location": "ಮಣಿಪಾಲ",
      "sources": [
        "ದಾಯ್ಜಿವರ್ಲ್ಡ್"
      ],
      "source_urls": [
        "https://daijiworld.com/news/newsDisplay?newsID=1326613"
      ],
      "status": "confirmed",
      "is_reel": false,
      "photo": {
        "path": "assets/daily/2026-09-25/manipal_infant_neurosurgery_medical_team.jpg",
        "nature": "ai",
        "credit": "ಊರ್ಮನಿ ಸುದ್ದಿ",
        "licence": "own",
        "caption": "ಮಣಿಪಾಲ ಆಸ್ಪತ್ರೆಯ ನರಶಸ್ತ್ರಚಿಕಿತ್ಸಾ ತಜ್ಞ ವೈದ್ಯರ ಸಮಾಲೋಚನೆ"
      },
      "verified_by": "Gautam Paduvari",
      "verified_at": "2026-09-25T15:51:46+0530"
    },
    {
      "headline": "ಕಾರ್ಕಳ ವಲಯ ಕ್ರೀಡಾಕೂಟ: ಕ್ರೈಸ್ಟ್ ಕಿಂಗ್ ಶಾಲೆಗೆ ಸಮಗ್ರ ವೀರಾಗ್ರಣಿ ಪ್ರಶಸ್ತಿ",
      "reel_line": "ಕಾರ್ಕಳ: ಕ್ರೈಸ್ಟ್ ಕಿಂಗ್ ಶಾಲೆಗೆ ಕ್ರೀಡಾ ಪ್ರಶಸ್ತಿ",
      "category": "sport",
      "deck": "ಕಾರ್ಕಳ ತಾಲೂಕು ಕ್ರೀಡಾಂಗಣದಲ್ಲಿ ಸಾರ್ವಜನಿಕ ಶಿಕ್ಷಣ ಇಲಾಖೆ ಆಯೋಜಿಸಿದ್ದ ವಲಯ ಪ್ರಾಥಮಿಕ ಶಾಲಾ ಕ್ರೀಡಾಕೂಟದಲ್ಲಿ ಕ್ರೈಸ್ಟ್ ಕಿಂಗ್ ಶಾಲೆಯ ಬಾಲಕಿಯರ ತಂಡ ಸಮಗ್ರ ವೀರಾಗ್ರಣಿ ಪ್ರಶಸ್ತಿ ಮುಡಿಗೇರಿಸಿಕೊಂಡಿದೆ.",
      "points": [
        "7ನೇ ತರಗತಿಯ ತ್ರಿಷ್ಮಾ 200 ಮೀಟರ್ ಹಾಗೂ 400 ಮೀಟರ್ ಓಟದಲ್ಲಿ ಪ್ರಥಮ ಸ್ಥಾನ ಪಡೆದು ವೈಯಕ್ತಿಕ ಚಾಂಪಿಯನ್ ಆಗಿದ್ದಾರೆ.",
        "ಪ್ರಾನ್ವಿ 100 ಮೀಟರ್ ಓಟದಲ್ಲಿ ಪ್ರಥಮ, ಆಶಿ ಶೆಟ್ಟಿ 600 ಮೀಟರ್‌ನಲ್ಲಿ ಪ್ರಥಮ ಹಾಗೂ ಬಾಲಕಿಯರ ರಿಲೇ ತಂಡ ಪ್ರಥಮ ಸ್ಥಾನ ಪಡೆದಿದೆ.",
        "ವಿಜೇತ ವಿದ್ಯಾರ್ಥಿಗಳು ತಾಲೂಕು ಮಟ್ಟದ ಕ್ರೀಡಾಕೂಟಕ್ಕೆ ಅಧಿಕೃತವಾಗಿ ಅರ್ಹತೆ ಪಡೆದುಕೊಂಡಿದ್ದಾರೆ."
      ],
      "reel_points": [
        "ವಲಯ ಮಟ್ಟದ ಪ್ರಾಥಮಿಕ ಕ್ರೀಡಾಕೂಟದಲ್ಲಿ ಕ್ರೈಸ್ಟ್ ಕಿಂಗ್ ಶಾಲೆಗೆ ಪ್ರಶಸ್ತಿ",
        "7ನೇ ತರಗತಿಯ ತ್ರಿಷ್ಮಾ 200 ಹಾಗೂ 400 ಮೀಟರ್ ಓಟದಲ್ಲಿ ಚಾಂಪಿಯನ್",
        "ವಿಜೇತ ವಿದ್ಯಾರ್ಥಿಗಳು ತಾಲೂಕು ಮಟ್ಟದ ಕೂಟಕ್ಕೆ ಅರ್ಹತೆ"
      ],
      "location": "ಕಾರ್ಕಳ",
      "sources": [
        "ದಾಯ್ಜಿವರ್ಲ್ಡ್"
      ],
      "source_urls": [
        "https://www.daijiworld.com/news/newsDisplay?newsID=1326573"
      ],
      "status": "confirmed",
      "is_reel": false,
      "photo": {
        "path": "assets/daily/2026-09-25/karkala_primary_school_girls_athletics_race.jpg",
        "nature": "ai",
        "credit": "ಊರ್ಮನಿ ಸುದ್ದಿ",
        "licence": "own",
        "caption": "ತಾಲೂಕು ಕ್ರೀಡಾಂಗಣದಲ್ಲಿ ನಡೆಯುತ್ತಿರುವ ಶಾಲಾ ಓಟದ ಸ್ಪರ್ಧೆ"
      },
      "verified_by": "Gautam Paduvari",
      "verified_at": "2026-09-25T15:51:46+0530"
    },
    {
      "headline": "ಉಡುಪಿ ಜಿಲ್ಲೆ: ಮತದಾರರ ಪಟ್ಟಿ ಪರಿಷ್ಕರಣೆ, ಅಕ್ಟೋಬರ್ 27ರಂದು ಅಂತಿಮ ಪಟ್ಟಿ",
      "reel_line": "ಉಡುಪಿ: ಮತದಾರರ ಪಟ್ಟಿ ಪರಿಷ್ಕರಣೆ; ಅಂತಿಮ ಪಟ್ಟಿ",
      "category": "civic",
      "deck": "ಉಡುಪಿ ಜಿಲ್ಲೆಯಲ್ಲಿ ವಿಶೇಷ ಮತದಾರರ ಪಟ್ಟಿ ಪರಿಷ್ಕರಣೆ ಪ್ರಗತಿಯಲ್ಲಿದ್ದು, ಜಿಲ್ಲೆಯಲ್ಲಿ 10,00,754 ಮತದಾರರಿದ್ದಾರೆ. ಅಕ್ಟೋಬರ್ 27ರಂದು ಅಂತಿಮ ಮತದಾರರ ಪಟ್ಟಿ ಪ್ರಕಟವಾಗಲಿದೆ ಎಂದು ಜಿಲ್ಲಾಡಳಿತ ತಿಳಿಸಿದೆ.",
      "points": [
        "ಜಿಲ್ಲೆಯಲ್ಲಿ ಒಟ್ಟು 1,244 ಮತಗಟ್ಟೆಗಳಿದ್ದು, 97,673 ನೋಟಿಸ್ಗಳ ಪೈಕಿ ಶೇ.99.02 ರಷ್ಟು ವಿತರಿಸಲಾಗಿದೆ.",
        "ಮತದಾರರ ಪಟ್ಟಿ ಸೇರ್ಪಡೆ, ತಿದ್ದುಪಡಿಗಾಗಿ 44,841 ಅರ್ಜಿಗಳು ಸಲ್ಲಿಕೆಯಾಗಿದ್ದು, ವಿಚಾರಣೆ ಪ್ರಗತಿಯಲ್ಲಿದೆ.",
        "ಅಕ್ಟೋಬರ್ 12ರೊಳಗೆ ವಿಚಾರಣೆ ಮುಗಿಸಿ, ಅಕ್ಟೋಬರ್ 22ರೊಳಗೆ ಆಕ್ಷೇಪಣೆ ವಿಲೇವಾರಿ ಮಾಡಲಾಗುವುದು."
      ],
      "reel_points": [
        "ಉಡುಪಿ ಜಿಲ್ಲೆಯಲ್ಲಿ ಪ್ರಸ್ತುತ ಒಟ್ಟು 10,00,754 ಮತದಾರರು",
        "ಶೇ.99.02 ರಷ್ಟು ಪರಿಶೀಲನಾ ನೋಟಿಸ್ ವಿತರಣೆ ಪೂರ್ಣ",
        "ಅಕ್ಟೋಬರ್ 27ರಂದು ಅಂತಿಮ ಮತದಾರರ ಪಟ್ಟಿ ಅಧಿಕೃತ ಪ್ರಕಟ"
      ],
      "location": "ಉಡುಪಿ",
      "sources": [
        "ದಾಯ್ಜಿವರ್ಲ್ಡ್"
      ],
      "source_urls": [
        "https://www.daijiworld.com/news/newsDisplay?newsID=1326567"
      ],
      "status": "confirmed",
      "is_reel": false,
      "photo": {
        "path": "assets/stock/taluk_revenue_office_files.jpg",
        "nature": "ai",
        "credit": "ಊರ್ಮನಿ ಸುದ್ದಿ",
        "licence": "own",
        "caption": "ಜಿಲ್ಲಾಡಳಿತ ಹಾಗೂ ಚುನಾವಣಾ ಆಯೋಗದ ಮತದಾರರ ಪಟ್ಟಿ ಪರಿಷ್ಕರಣೆ ಕಡತಗಳು"
      },
      "verified_by": "Gautam Paduvari",
      "verified_at": "2026-09-25T15:51:46+0530"
    }
  ]
}
