{
  "date": "2026-09-24T18:00:00+05:30",
  "edition_no": 2,
  "strapline": "ಕರಾವಳಿ ಸಂಜೆ ಆವೃತ್ತಿ",
  "stories": [
    {
      "headline": "ಉಡುಪಿ: 10.01 ಲಕ್ಷ ಮತದಾರರು, ಅಕ್ಟೋಬರ್ 27ಕ್ಕೆ ಅಂತಿಮ ಪಟ್ಟಿ",
      "reel_line": "ಉಡುಪಿಯಲ್ಲಿ 10.01 ಲಕ್ಷ ಮತದಾರರು, ಅಂತಿಮ ಪಟ್ಟಿ",
      "category": "civic",
      "deck": "ಮತದಾರರ ಪಟ್ಟಿಗಳ ವಿಶೇಷ ಪರಿಷ್ಕರಣೆ (SIR-2026) ಅಂಕಿಅಂಶಗಳನ್ನು ಜಿಲ್ಲಾಡಳಿತ ಬಿಡುಗಡೆ ಮಾಡಿದ್ದು, ಜಿಲ್ಲೆಯಲ್ಲಿ ಒಟ್ಟು 10,00,754 ಮತದಾರರಿದ್ದಾರೆ. ಅಕ್ಟೋಬರ್ 27ಕ್ಕೆ ಅಂತಿಮ ಪಟ್ಟಿ ಪ್ರಕಟವಾಗಲಿದೆ.",
      "points": [
        "ಜಿಲ್ಲೆಯಲ್ಲಿ 4,84,236 ಪುರುಷರು, 5,16,509 ಮಹಿಳೆಯರು, 9 ತೃತೀಯ ಲಿಂಗಿ ಮತದಾರರು",
        "ಶೇ.99.02 ರಷ್ಟು ನೋಟಿಸ್ ವಿತರಣೆ ಪೂರ್ಣ, ಒಟ್ಟು 1,244 ಮತಗಟ್ಟೆಗಳು",
        "ಅಕ್ಟೋಬರ್ 1ಕ್ಕೆ 18 ವರ್ಷ ಪೂರೈಸುವ ಯುವಜನರಿಗೆ ಮತದಾರರ ಪಟ್ಟಿಗೆ ಸೇರ್ಪಡೆಗೆ ಅವಕಾಶ"
      ],
      "location": "ಉಡುಪಿ",
      "sources": [
        "Daijiworld"
      ],
      "source_urls": [
        "https://www.daijiworld.com/news/newsDisplay?newsID=1326567"
      ],
      "status": "official",
      "is_reel": false,
      "photo": {
        "path": "assets/stock/taluk_revenue_office_files.jpg",
        "nature": "ai",
        "credit": "ಊರ್ಮನಿ ಸುದ್ದಿ",
        "licence": "own",
        "caption": "ಜಿಲ್ಲಾಡಳಿತ ಹಾಗೂ ಚುನಾವಣಾ ಆಯೋಗದ ಮತದಾರರ ಪಟ್ಟಿ ಪರಿಷ್ಕರಣೆ ಕಡತಗಳು"
      },
      "verified_by": "Gautam Paduvari",
      "verified_at": "2026-09-24T18:00:00+0530"
    },
    {
      "headline": "ಮಂಗಳೂರು–ಕುವೈತ್ ನೇರ ವಿಮಾನ ಸೇವೆ ಪುನರಾರಂಭ ಸಾಧ್ಯತೆ",
      "reel_line": "ಮಂಗಳೂರು ಕುವೈತ್ ನೇರ ವಿಮಾನ ಸೇವೆ ಪುನರಾರಂಭ",
      "category": "explainer",
      "deck": "ಸ್ಥಗಿತಗೊಂಡಿದ್ದ ಮಂಗಳೂರು ಮತ್ತು ಕುವೈತ್ ನಡುವಿನ ನೇರ ವಿಮಾನ ಸೇವೆಯನ್ನು ಏರ್ ಇಂಡಿಯಾ ಎಕ್ಸ್‌ಪ್ರೆಸ್ ಅಕ್ಟೋಬರ್ 27 ರಿಂದ ವಾರಕ್ಕೆ 3 ದಿನ ಪುನರಾರಂಭಿಸಲು ಸಿದ್ಧತೆ ನಡೆಸಿದೆ.",
      "points": [
        "ಯುದ್ಧದ ಹಿನ್ನೆಲೆಯಲ್ಲಿ ಕಳೆದ 6 ತಿಂಗಳಿನಿಂದ ಸ್ಥಗಿತಗೊಂಡಿದ್ದ ನೇರ ವಿಮಾನ ಸೇವೆ",
        "ಚಳಿಗಾಲದ ವೇಳಾಪಟ್ಟಿಯಡಿ ಮಂಗಳವಾರ, ಶುಕ್ರವಾರ, ಶನಿವಾರ ಕಾರ್ಯಾಚರಣೆ ಸಾಧ್ಯತೆ",
        "ಕರಾವಳಿಯ ಅನಿವಾಸಿ ಭಾರತೀಯರಿಗೆ ಹಾಗೂ ಗಲ್ಫ್ ಪ್ರಯಾಣಿಕರಿಗೆ ಭಾರಿ ಅನುಕೂಲ"
      ],
      "location": "ಮಂಗಳೂರು",
      "sources": [
        "News Karnataka"
      ],
      "source_urls": [
        "http://kannada.newskarnataka.com/mangaluru/possibility-of-resuming-the-suspended-mangaluru-kuwait-direct-flight-service/22092026"
      ],
      "status": "developing",
      "is_reel": false,
      "photo": {
        "path": "assets/daily/2026-09-24/mangaluru_airport_runway_flight.jpg",
        "nature": "ai",
        "credit": "ಊರ್ಮನಿ ಸುದ್ದಿ",
        "licence": "own",
        "caption": "ಮಂಗಳೂರು ಅಂತಾರಾಷ್ಟ್ರೀಯ ವಿಮಾನ ನಿಲ್ದಾಣದ ರನ್‌ವೇಯಲ್ಲಿ ವಿಮಾನ"
      },
      "verified_by": "Gautam Paduvari",
      "verified_at": "2026-09-24T18:00:00+0530"
    },
    {
      "headline": "ಶಿರ್ಲಾಲು: ವಿಶೇಷ ಗ್ರಾಮಸಭೆಗೆ ಅಧಿಕಾರಿಗಳ ಗೈರು, ಜನರ ಆಕ್ರೋಶ",
      "reel_line": "ಶಿರ್ಲಾಲು ಗ್ರಾಮಸಭೆಗೆ ಅಧಿಕಾರಿಗಳು ಗೈರು",
      "category": "civic",
      "deck": "ಕಸ್ತೂರಿರಂಗನ್ ವರದಿ ಅಧಿಸೂಚನೆ ವಿರೋಧಿಸಿ ಕರೆದಿದ್ದ ವಿಶೇಷ ಗ್ರಾಮಸಭೆಗೆ ಪಿಡಿಒ ಹಾಗೂ ಇಲಾಖಾ ಅಧಿಕಾರಿಗಳು ಹಾಜರಾಗದೆ ನೂರಾರು ಗ್ರಾಮಸ್ಥರು ಬಿಸಿಲಿನಲ್ಲಿ ಕಾದು ತೀವ್ರ ಆಕ್ರೋಶ ವ್ಯಕ್ತಪಡಿಸಿದರು.",
      "points": [
        "ಕಸ್ತೂರಿರಂಗನ್ ಬಾಧಿತ ಗ್ರಾಮಸ್ಥರ ಸಲಹೆ, ಆಕ್ಷೇಪಣೆ ಪಡೆಯಲು ಕರೆದಿದ್ದ ಸಭೆ",
        "ಪಿಡಿಒ ರಜೆ ಹಾಕಿ ಗೈರು, ಅಗತ್ಯ ಇಲಾಖೆ ಅಧಿಕಾರಿಗಳೂ ಗೈರಾಗಿದ್ದಕ್ಕೆ ಜನರ ತೀವ್ರ ಆಕ್ಷೇಪ",
        "ಸ್ಥಳಕ್ಕೆ ಮುಖಂಡರ ಭೇಟಿ, ತಪ್ಪಿತಸ್ಥ ಅಧಿಕಾರಿಗಳ ವಿರುದ್ಧ ಶಿಸ್ತು ಕ್ರಮಕ್ಕೆ ಆಗ್ರಹ"
      ],
      "location": "ಬೆಳ್ತಂಗಡಿ",
      "sources": [
        "News Karnataka"
      ],
      "source_urls": [
        "http://kannada.newskarnataka.com/mangaluru/special-gram-sabha-of-shirlalu-gram-panchayat/22092026"
      ],
      "status": "confirmed",
      "is_reel": false,
      "photo": {
        "path": "assets/stock/coastal_ghats_monsoon_homestead.jpg",
        "nature": "ai",
        "credit": "ಊರ್ಮನಿ ಸುದ್ದಿ",
        "licence": "own",
        "caption": "ಪಶ್ಚಿಮ ಘಟ್ಟಗಳ ಪರಿಸರ ಸೂಕ್ಷ್ಮ ಪ್ರದೇಶ ವ್ಯಾಪ್ತಿಯ ಗ್ರಾಮೀಣ ಭಾಗ"
      },
      "verified_by": "Gautam Paduvari",
      "verified_at": "2026-09-24T18:00:00+0530"
    },
    {
      "headline": "ಪುತ್ತೂರು: ಭ್ರಷ್ಟಾಚಾರ ಆರೋಪದಡಿ ಆರ್ಯಾಪು ಪಿಡಿಒ ಅಮಾನತು",
      "reel_line": "ಭ್ರಷ್ಟಾಚಾರ ಆರೋಪದಡಿ ಆರ್ಯಾಪು ಪಿಡಿಒ ಅಮಾನತು",
      "category": "crime",
      "deck": "ಉಪ್ಪಿನಂಗಡಿ ಹಾಗೂ ಆರ್ಯಾಪು ಗ್ರಾ.ಪಂ. ಪಿಡಿಒ ವಿಲ್ಫ್ರೆಡ್ ಲಾರೆನ್ಸ್ ರೊಡ್ರಿಗಸ್ ವಿರುದ್ಧ ಭ್ರಷ್ಟಾಚಾರ ಹಾಗೂ ಕರ್ತವ್ಯ ಲೋಪದ ಆರೋಪಗಳ ಹಿನ್ನೆಲೆಯಲ್ಲಿ ಜಿ.ಪಂ. ಸಿಇಒ ಅಮಾನತು ಆದೇಶ ಹೊರಡಿಸಿದ್ದಾರೆ.",
      "points": [
        "ಲೋಕಾಯುಕ್ತ ಭೇಟಿ ವೇಳೆ ಸಾರ್ವಜನಿಕರಿಂದ ದಾಖಲೆ ಸಮೇತ ದೂರು ಸಲ್ಲಿಕೆ",
        "ಸಾರ್ವಜನಿಕರಿಗೆ ಸೇವೆ ವಿಳಂಬ, ಲಂಚದ ಬೇಡಿಕೆ ಆರೋಪ ಮೇಲ್ನೋಟಕ್ಕೆ ದೃಢ",
        "ಕರ್ನಾಟಕ ನಾಗರಿಕ ಸೇವಾ ನಿಯಮಾವಳಿ ಉಲ್ಲಂಘನೆ ಹಿನ್ನೆಲೆ ಇಲಾಖಾ ತನಿಖೆಗೆ ಆದೇಶ"
      ],
      "location": "ಪುತ್ತೂರು",
      "sources": [
        "Daijiworld"
      ],
      "source_urls": [
        "https://www.daijiworld.com/news/newsDisplay?newsID=1326570"
      ],
      "status": "official",
      "is_reel": false,
      "photo": {
        "path": "assets/stock/coastal_court_complex_judiciary.jpg",
        "nature": "ai",
        "credit": "ಊರ್ಮನಿ ಸುದ್ದಿ",
        "licence": "own",
        "caption": "ನ್ಯಾಯಾಲಯ ಹಾಗೂ ಆಡಳಿತಾತ್ಮಕ ತನಿಖಾ ಪ್ರಕ್ರಿಯೆ"
      },
      "verified_by": "Gautam Paduvari",
      "verified_at": "2026-09-24T18:00:00+0530"
    },
    {
      "headline": "‘ತುಳು ಭಾಷೆ ಮಾನ್ಯತೆ 2 ಜಿಲ್ಲೆಗೆ ಸೀಮಿತ ಸರಿಯಲ್ಲ’: ಮಧ್ವರಾಜ್",
      "reel_line": "ತುಳು ಭಾಷೆ ಮಾನ್ಯತೆ 8ನೇ ಅನುಸೂಚಿಗೆ ಸೇರಲಿ",
      "category": "explainer",
      "deck": "ತುಳು ಭಾಷೆಗೆ ಅಧಿಕೃತ ಸ್ಥಾನಮಾನದ ಪ್ರಕ್ರಿಯೆ ಸ್ವಾಗತಿಸಿರುವ ಮಾಜಿ ಸಚಿವ ಪ್ರಮೋದ್ ಮಧ್ವರಾಜ್, ಈ ಮಾನ್ಯತೆಯನ್ನು ಕೇವಲ ಉಡುಪಿ-ದ.ಕ.ಕ್ಕೆ ಸೀಮಿತಗೊಳಿಸದೆ 8ನೇ ಅನುಸೂಚಿಗೆ ಸೇರಿಸಲು ಆಗ್ರಹಿಸಿದ್ದಾರೆ.",
      "points": [
        "ತುಳು ಭಾಷೆಗೆ ಅಧಿಕೃತ ಸ್ಥಾನಮಾನ ನೀಡುವ ಸರ್ಕಾರದ ನಿರ್ಧಾರಕ್ಕೆ ಸ್ವಾಗತ",
        "ಕೇವಲ ಅವಳಿ ಜಿಲ್ಲೆಗಳಿಗೆ ಸೀಮಿತಗೊಳಿಸದೆ ರಾಜ್ಯದಾದ್ಯಂತ ಮಾನ್ಯತೆ ನೀಡಲು ಒತ್ತಾಯ",
        "ಸಂವಿಧಾನದ 8ನೇ ಅನುಸೂಚಿಗೆ ತುಳು ಸೇರ್ಪಡೆಗೆ ಸೂಕ್ತ ಕ್ರಮ ಕೈಗೊಳ್ಳಲು ಆಗ್ರಹ"
      ],
      "location": "ಉಡುಪಿ",
      "sources": [
        "News Karnataka"
      ],
      "source_urls": [
        "http://kannada.newskarnataka.com/udupi/recognition-of-the-tulu-language/22092026"
      ],
      "status": "confirmed",
      "is_reel": false,
      "photo": {
        "path": "assets/stock/kannada_sahitya_sambhrama_stage.jpg",
        "nature": "ai",
        "credit": "ಊರ್ಮನಿ ಸುದ್ದಿ",
        "licence": "own",
        "caption": "ಕರಾವಳಿ ಸಾಹಿತ್ಯ ಹಾಗೂ ಭಾಷಾ ಸಂಸ್ಕೃತಿಯ ಸಮ್ಮೇಳನ ವೇದಿಕೆ"
      },
      "verified_by": "Gautam Paduvari",
      "verified_at": "2026-09-24T18:00:00+0530"
    },
    {
      "headline": "ಮಂಗಳೂರು: ಲಂಚ ಸ್ವೀಕಾರ ಆರೋಪ, ಬಜಪೆ ಇನ್‌ಸ್ಪೆಕ್ಟರ್ ಬಲೆಗೆ",
      "reel_line": "ಲಂಚ ಸ್ವೀಕಾರ ಆರೋಪ: ಬಜಪೆ ಇನ್‌ಸ್ಪೆಕ್ಟರ್ ಬಲೆಗೆ",
      "category": "crime",
      "deck": "ಚೀಟಿಂಗ್ ಪ್ರಕರಣದ ಹಣ ಬಿಡುಗಡೆ ಮಾಡಲು ₹5,000 ಲಂಚದ ಹಣ ಪಡೆಯುತ್ತಿದ್ದ ಮಂಗಳೂರಿನ ಬಜಪೆ ಪೊಲೀಸ್ ಇನ್‌ಸ್ಪೆಕ್ಟರ್ ಲೋಕಾಯುಕ್ತ ಅಧಿಕಾರಿಗಳ ಬಲೆಗೆ ರೆಡ್‌ಹ್ಯಾಂಡಾಗಿ ಬಿದ್ದಿದ್ದಾರೆ.",
      "points": [
        "ಆರೋಪಿಗಳಿಂದ ವಶಪಡಿಸಿಕೊಂಡಿದ್ದ ಹಣ ಬಿಡುಗಡೆಗೆ ₹25,000 ಲಂಚಕ್ಕೆ ಬೇಡಿಕೆ ಆರೋಪ",
        "ಮುಂಗಡವಾಗಿ ₹5,000 ಲಂಚ ಪಡೆಯುವ ವೇಳೆ ದಾಳಿ ನಡೆಸಿದ ಲೋಕಾಯುಕ್ತ ಅಧಿಕಾರಿಗಳು",
        "ಇನ್‌ಸ್ಪೆಕ್ಟರ್ ವಶಕ್ಕೆ, ಭ್ರಷ್ಟಾಚಾರ ನಿಯಂತ್ರಣ ಕಾಯ್ದೆಯಡಿ ತನಿಖೆ ಮುಂದುವರಿಕೆ"
      ],
      "location": "ಮಂಗಳೂರು",
      "sources": [
        "News Karnataka"
      ],
      "source_urls": [
        "http://kannada.newskarnataka.com/mangaluru/police-inspector-caught-in-lokayukta-officials-trap/22092026"
      ],
      "status": "confirmed",
      "is_reel": false,
      "photo": {
        "path": "assets/stock/crime_scene_police_cordon.jpg",
        "nature": "ai",
        "credit": "ಊರ್ಮನಿ ಸುದ್ದಿ",
        "licence": "own",
        "caption": "ಲೋಕಾಯುಕ್ತ ಅಧಿಕಾರಿಗಳ ಕಾರ್ಯಾಚರಣೆ ಹಾಗೂ ತನಿಖೆ"
      },
      "verified_by": "Gautam Paduvari",
      "verified_at": "2026-09-24T18:00:00+0530"
    }
  ]
}
