{
  "schema_version": 4,
  "date": "2026-09-27T08:00:00+05:30",
  "edition_no": 1,
  "strapline": "ಕರಾವಳಿ ದಿನಪತ್ರಿಕೆ",
  "stories": [
    {
      "segment": "saara",
      "photo_plan": "",
      "headline": "ಕುಂದಾಪುರ-ಬೈಂದೂರು: ರಾಷ್ಟ್ರೀಯ ಹೆದ್ದಾರಿ 66ರಲ್ಲಿ ಗ್ರೇಡ್ ಸೆಪರೇಟರ್‌ಗೆ ಪ್ರಸ್ತಾವನೆ",
      "category": "civic",
      "deck": "ರಾಷ್ಟ್ರೀಯ ಹೆದ್ದಾರಿ 66ರ ತಲ್ಲೂರು, ಹೇರ್ಮಾಡಿ, ತ್ರಾಸಿ, ಅರಾಟೆ ಹಾಗೂ ಯಡ್ತರೆ ಜಂಕ್ಷನ್‌ಗಳಲ್ಲಿ ನೂತನ ಗ್ರೇಡ್ ಸೆಪರೇಟರ್ ಮತ್ತು ಸಮಾನಾಂತರ ಸೇತುವೆ ನಿರ್ಮಾಣಕ್ಕೆ ಹೆದ್ದಾರಿ ಪ್ರಾಧಿಕಾರ ಸಮಗ್ರ ಪ್ರಸ್ತಾವನೆ ಸಿದ್ಧಪಡಿಸಿದೆ.",
      "points": [
        "ತಲ್ಲೂರು, ಹೇರ್ಮಾಡಿ, ತ್ರಾಸಿ, ಅರಾಟೆ ಸೇತುವೆ ಹಾಗೂ ಯಡ್ತರೆ ಜಂಕ್ಷನ್‌ಗಳಲ್ಲಿ ಮೇಲ್ಸೇತುವೆ ಮತ್ತು ವಾಹನ ಕೆಳಸೇತುವೆ ನಿರ್ಮಾಣಕ್ಕೆ ಸ್ಥಳ ಪರಿಶೀಲನೆ ಪೂರ್ಣ.",
        "ವಾಹನ ದಟ್ಟಣೆಯ ಕೋಟೇಶ್ವರ ಬೈಪಾಸ್ ಅನ್ನು ಗ್ರೇಡ್ ಸೆಪರೇಟರ್ ಯೋಜನೆ ಪಟ್ಟಿಗೆ ಸೇರ್ಪಡೆಗೊಳಿಸಲು ನಾಗರಿಕರು ಮತ್ತು ಉದ್ಯಮಿಗಳ ಆಗ್ರಹ.",
        "ತಲಪಾಡಿಯಿಂದ ಬೈಂದೂರು ವರೆಗಿನ ಹೆದ್ದಾರಿ ವಿಸ್ತರಣೆ ಮತ್ತು ಅಪಘಾತ ವಲಯಗಳ ಸುಧಾರಣೆ ಪ್ರಗತಿಯಲ್ಲಿದೆ ಎಂದು ಹೆದ್ದಾರಿ ಪ್ರಾಧಿಕಾರ ಮಾಹಿತಿ."
      ],
      "location": "ಕುಂದಾಪುರ",
      "sources": [
        "Daijiworld"
      ],
      "source_urls": [
        "https://www.daijiworld.com/news/newsDisplay?newsID=1326777"
      ],
      "status": "developing",
      "published_at": "2026-09-27T08:00:00+05:30",
      "verified_by": "Gautam Paduvari",
      "verified_at": "2026-09-27T10:20:58+0530"
    },
    {
      "segment": "saara",
      "photo_plan": "",
      "headline": "ಬೈಂದೂರು: ಮತ್ಸ್ಯಾಶ್ರಯ ಯೋಜನೆಯ ಮನೆ ನಿರ್ಮಾಣ ಸಹಾಯಧನ ಬಿಡುಗಡೆಗೆ ಆಗ್ರಹ",
      "category": "fisheries",
      "deck": "ಕರಾವಳಿ ವ್ಯಾಪ್ತಿಯ ಸಾಂಪ್ರದಾಯಿಕ ಮೀನುಗಾರ ಕುಟುಂಬಗಳಿಗೆ ಮತ್ಸ್ಯಾಶ್ರಯ ಯೋಜನೆಯಡಿ ನಿಗದಿತ ಮನೆ ನಿರ್ಮಾಣ ಸಹಾಯಧನದ ಕಂತುಗಳು ತಿಂಗಳುಗಳಿಂದ ಬಿಡುಗಡೆಯಾಗದೆ ಫಲಾನುಭವಿಗಳು ತೀವ್ರ ಆರ್ಥಿಕ ಇಕ್ಕಟ್ಟಿಗೆ ಸಿಲುಕಿದ್ದಾರೆ.",
      "points": [
        "ಸರ್ಕಾರದ ಆದೇಶ ನಂಬಿ ಸಾಲ ಮಾಡಿ ಅಡಿಪಾಯ ಮತ್ತು ಗೋಡೆ ನಿರ್ಮಿಸಿರುವ ಮೀನುಗಾರರಿಗೆ ಹಣ ಜಮೆಯಾಗದೆ ಅರ್ಧಕ್ಕೆ ನಿಂತ ಮನೆಗಳು.",
        "ಬೈಂದೂರು, ಶಿರೂರು, ಮರವಂತೆ, ಗಂಗೊಳ್ಳಿ, ಕೋಡಿ, ಮಣೂರು ಹಾಗೂ ಕೋಟ ಕರಾವಳಿಯ ನೂರಾರು ಬಡ ಕುಟುಂಬಗಳು ಬಾಡಿಗೆ ಮನೆಗಳಲ್ಲಿ ದಿನದೂಡುವ ಸ್ಥಿತಿ.",
        "ಮೀನುಗಾರ ಸಮುದಾಯದ ಸಂಕಷ್ಟ ಪರಿಗಣಿಸಿ ಬಾಕಿ ಉಳಿದಿರುವ ಎಲ್ಲಾ ಅನುದಾನವನ್ನು ತಕ್ಷಣ ಬಿಡುಗಡೆ ಮಾಡಲು ಮೀನುಗಾರಿಕಾ ಸಂಘಟನೆಗಳ ಮನವಿ."
      ],
      "location": "ಬೈಂದೂರು",
      "sources": [
        "ಉದಯವಾಣಿ"
      ],
      "source_urls": [
        "https://udayavani.com/udupi-news/matsyashraya-scheme-fails-to-provide-shelter-085258?lang=kn"
      ],
      "status": "developing",
      "published_at": "2026-09-27T08:00:00+05:30",
      "verified_by": "Gautam Paduvari",
      "verified_at": "2026-09-27T10:20:58+0530"
    },
    {
      "segment": "saara",
      "photo_plan": "",
      "headline": "ಕುಂದಾಪುರ: ಎಂ ಕೋಡಿ ಕಡಲತೀರಕ್ಕೆ ಅಪಾರ ಪ್ರಮಾಣದ ಬೂತಾಯಿ ಮೀನುಗಳ ಆಗಮನ",
      "category": "environment",
      "deck": "ಕುಂದಾಪುರದ ಎಂ ಕೋಡಿ ಕಡಲತೀರದಲ್ಲಿ ಅರಬ್ಬಿ ಸಮುದ್ರದ ಅಲೆಗಳೊಂದಿಗೆ ಜೀವಂತ ಬೂತಾಯಿ ಮೀನುಗಳು ರಾಶಿ ರಾಶಿಯಾಗಿ ತೀರಕ್ಕೆ ಬಂದಿದ್ದು, ನೂರಾರು ಸಾರ್ವಜನಿಕರು ಬಕೆಟ್ ಹಾಗೂ ಗೋಣಿಚೀಲಗಳೊಂದಿಗೆ ಧಾವಿಸಿ ಮೀನುಗಳನ್ನು ಕಲೆಹಾಕಿದರು.",
      "points": [
        "ಶನಿವಾರ ಮುಂಜಾನೆ ಕಡಲತೀರದಲ್ಲಿ ರಾಶಿ ಬಿದ್ದ ಬೆಳ್ಳಿಯಂತೆ ಹೊಳೆಯುತ್ತಿದ್ದ ಮೀನುಗಳನ್ನು ಕಂಡ ಸ್ಥಳೀಯರು.",
        "ನೀರಿನ ಹರಿವಿನ ಏರಿಳಿತ, ಬಿಸಿಲು-ಮಳೆಯ ವಾತಾವರಣದ ಹಠಾತ್ ಬದಲಾವಣೆ ಅಥವಾ ದೊಡ್ಡ ಮೀನುಗಳ ದಾಳಿಗೆ ಬೆದರಿ ಮೀನಿನ ಹಿಂಡು ದಡ ಸೇರಿರಬಹುದು ಎಂದು ಮೀನುಗಾರರ ಅಭಿಪ್ರಾಯ.",
        "ಕಡಲತೀರಕ್ಕೆ ಬಂದ ಅಪರೂಪದ ಸಮೃದ್ಧ ಮೀನಿನ ರಾಶಿಯನ್ನು ಕಣ್ತುಂಬಿಕೊಳ್ಳಲು ಹೆಚ್ಚಿನ ಸಂಖ್ಯೆಯಲ್ಲಿ ಜಮಾಯಿಸಿದ ಗ್ರಾಮಸ್ಥರು ಹಾಗೂ ಪ್ರವಾಸಿಗರು."
      ],
      "location": "ಕುಂದಾಪುರ",
      "sources": [
        "Daijiworld"
      ],
      "source_urls": [
        "https://www.daijiworld.com/news/newsDisplay?newsID=1326749"
      ],
      "status": "confirmed",
      "published_at": "2026-09-27T08:00:00+05:30",
      "verified_by": "Gautam Paduvari",
      "verified_at": "2026-09-27T10:20:58+0530"
    },
    {
      "segment": "saara",
      "photo_plan": "",
      "headline": "ಕುಂದಾಪುರ: ಕೋಡಿ ದೀಪಸ್ತಂಭ ಕಡಲತೀರಕ್ಕೆ ಬೃಹತ್ ಡಾಲ್ಫಿನ್ ಕಳೇಬರ",
      "category": "environment",
      "deck": "ಕುಂದಾಪುರದ ಕೋಡಿ ದೀಪಸ್ತಂಭ ಸಮೀಪದ ಕಡಲತೀರಕ್ಕೆ ಬೃಹತ್ ಡಾಲ್ಫಿನ್ ಕಳೇಬರ ತೇಲಿಬಂದಿದ್ದು, ಪುರಸಭೆ ಹಾಗೂ ಕರಾವಳಿ ಅರಣ್ಯ ಇಲಾಖೆ ಸಿಬ್ಬಂದಿ ಸ್ಥಳ ಪರಿಶೀಲನೆ ನಡೆಸಿ ಕಡಲತೀರದಲ್ಲೇ ವೈಜ್ಞಾನಿಕವಾಗಿ ಹೂತು ವಿಲೇವಾರಿ ಮಾಡಿದ್ದಾರೆ.",
      "points": [
        "ಬಂಡೆಗಲ್ಲುಗಳಿಗೆ ಅಪ್ಪಳಿಸಿ ಅಥವಾ ಮೀನುಗಾರಿಕಾ ಬೋಟಿನ ಯಂತ್ರಕ್ಕೆ ಸಿಲುಕಿ ಗಂಭೀರ ಗಾಯಗೊಂಡು ಕಡಲಜೀವಿ ಸಾವನ್ನಪ್ಪಿರುವ ಶಂಕೆ.",
        "ದೊಡ್ಡ ಗಾತ್ರದ ಡಾಲ್ಫಿನ್ ನೋಡಲು ಸ್ಥಳಕ್ಕೆ ಧಾವಿಸಿದ ಸ್ಥಳೀಯ ನಿವಾಸಿಗಳು ಹಾಗೂ ಪ್ರವಾಸಿಗರು.",
        "ಪುರಸಭೆ ಹಾಗೂ ಅರಣ್ಯ ಇಲಾಖೆ ಸಿಬ್ಬಂದಿಯಿಂದ ಕಡಲತೀರದಲ್ಲೇ ದೊಡ್ಡ ಗುಂಡಿ ತೋಡಿ ಕಳೇಬರವನ್ನು ವೈಜ್ಞಾನಿಕವಾಗಿ ಹೂತು ವಿಲೇವಾರಿ."
      ],
      "location": "ಕುಂದಾಪುರ",
      "sources": [
        "ಉದಯವಾಣಿ"
      ],
      "source_urls": [
        "https://udayavani.com/udupi-news/kundapura-kodi-lighthouse-dath-of-a-massive-dolphin-382089?lang=kn"
      ],
      "status": "confirmed",
      "published_at": "2026-09-27T08:00:00+05:30",
      "verified_by": "Gautam Paduvari",
      "verified_at": "2026-09-27T10:20:58+0530"
    },
    {
      "segment": "saara",
      "photo_plan": "",
      "headline": "ಗಂಗೊಳ್ಳಿ: ಬಂದರಿನಲ್ಲಿ ಕಾಮಗಾರಿ ವೇಳೆ ಬಿದ್ದು ಗಾಯಗೊಂಡಿದ್ದ ಕಾರ್ಮಿಕ ಸಾವು",
      "category": "accident",
      "deck": "ಕುಂದಾಪುರ ತಾಲೂಕಿನ ಗಂಗೊಳ್ಳಿ ಬಂದರು ವ್ಯಾಪ್ತಿಯಲ್ಲಿ ಕೆಲಸ ಮಾಡುತ್ತಿದ್ದ ವೇಳೆ ಆಕಸ್ಮಿಕವಾಗಿ ಬಿದ್ದು ತೀವ್ರ ಗಾಯಗೊಂಡು ಆಸ್ಪತ್ರೆಗೆ ದಾಖಲಾಗಿದ್ದ ಕಾರ್ಮಿಕರೊಬ್ಬರು ಚಿಕಿತ್ಸೆ ಫಲಕಾರಿಯಾಗದೆ ಕೊನೆಯುಸಿರೆಳೆದಿದ್ದಾರೆ.",
      "points": [
        "ತಲೆ ಮತ್ತು ದೇಹಕ್ಕೆ ತೀವ್ರ ಪೆಟ್ಟು ಬಿದ್ದಿದ್ದರಿಂದ ಆಸ್ಪತ್ರೆಗೆ ದಾಖಲಿಸಿದರೂ ಚಿಕಿತ್ಸೆ ಫಲಕಾರಿಯಾಗದೆ ಸಾವು.",
        "ಗಂಗೊಳ್ಳಿ ಆರಕ್ಷಕ ಠಾಣೆಯಲ್ಲಿ ಅಸ್ವಾಭಾವಿಕ ಸಾವು ಪ್ರಕರಣ ದಾಖಲು, ಮರಣೋತ್ತರ ಪರೀಕ್ಷೆಯ ಬಳಿಕ ಕುಟುಂಬಕ್ಕೆ ಮೃತದೇಹ ಹಸ್ತಾಂತರ.",
        "ಬಂದರು ಹಾಗೂ ಹಡಗುಕಟ್ಟೆ ಕಾಮಗಾರಿಗಳ ಪ್ರದೇಶದಲ್ಲಿ ದುಡಿಯುವ ಕಾರ್ಮಿಕರಿಗೆ ರಕ್ಷಣಾ ಸುರಕ್ಷತಾ ಉಪಕರಣಗಳನ್ನು ಒದಗಿಸಲು ಮುಖಂಡರ ಆಗ್ರಹ."
      ],
      "location": "ಕುಂದಾಪುರ",
      "sources": [
        "ಉದಯವಾಣಿ"
      ],
      "source_urls": [
        "https://udayavani.com/udupi-news/gangolli-injured-worker-dies-849090?lang=kn"
      ],
      "status": "confirmed",
      "published_at": "2026-09-27T08:00:00+05:30",
      "verified_by": "Gautam Paduvari",
      "verified_at": "2026-09-27T10:20:58+0530"
    },
    {
      "segment": "saara",
      "photo_plan": "",
      "headline": "ಬ್ರಹ್ಮಾವರ: ಸಾವಯವ ಸಂಯುಕ್ತ ರೈತ ಉತ್ಪಾದಕ ಕಂಪನಿ ಶಾಖೆ ಲೋಕಾರ್ಪಣೆ",
      "category": "farm",
      "deck": "ಸಾವಯವ ಕೃಷಿ ವಿಸ್ತರಣೆ ಮತ್ತು ರೈತರ ಉತ್ಪನ್ನಗಳಿಗೆ ನೇರ ಮಾರುಕಟ್ಟೆ ಸಂಪರ್ಕ ಕಲ್ಪಿಸುವ ಧ್ಯೇಯದೊಂದಿಗೆ ದಕ್ಷಿಣ ಕನ್ನಡ ಬೆಳೆಗಾರರ ಸಾವಯವ ರೈತ ಉತ್ಪಾದಕ ಕಂಪನಿಯ ನೂತನ ಶಾಖಾ ಕಚೇರಿ ಬ್ರಹ್ಮಾವರದಲ್ಲಿ ಅಧಿಕೃತವಾಗಿ ಆರಂಭವಾಗಿದೆ.",
      "points": [
        "ಕೃಷಿಕರು ಹಾಗೂ ಸಹಕಾರಿ ಮುಖಂಡರ ಉಪಸ್ಥಿತಿಯಲ್ಲಿ ಬ್ರಹ್ಮಾವರ ಪಟ್ಟಣದಲ್ಲಿ ನೂತನ ಶಾಖಾ ಕಚೇರಿ ಲೋಕಾರ್ಪಣೆ.",
        "ಬ್ರಹ್ಮಾವರ, ಬಾರ್ಕೂರು, ಕೋಟ ಹಾಗೂ ಮಂದಾರ್ತಿ ಕೃಷಿ ವಲಯದ ಅಡಿಕೆ, ಭತ್ತ ಮತ್ತು ತೋಟಗಾರಿಕಾ ಬೆಳೆಗಾರರಿಗೆ ಮಧ್ಯವರ್ತಿಗಳಿಲ್ಲದೆ ಮೌಲ್ಯವರ್ಧನೆ.",
        "ರೈತ ಉತ್ಪಾದಕ ಸಂಸ್ಥೆಗಳಿಂದ ಸ್ಥಳೀಯ ಮಟ್ಟದಲ್ಲೇ ಕೃಷಿ ವೆಚ್ಚ ತಗ್ಗಿಸಿ ಆದಾಯ ಹೆಚ್ಚಿಸಲು ಸಹಕಾರಿ ಎಂದು ತಜ್ಞರ ಅಭಿಪ್ರಾಯ."
      ],
      "location": "ಬ್ರಹ್ಮಾವರ",
      "sources": [
        "ಉದಯವಾಣಿ"
      ],
      "source_urls": [
        "https://udayavani.com/udupi-news/inauguration-of-the-brahmavar-branch-of-the-dk-growers-organic-farmers-producer-company-ltd-489431?lang=kn"
      ],
      "status": "confirmed",
      "published_at": "2026-09-27T08:00:00+05:30",
      "verified_by": "Gautam Paduvari",
      "verified_at": "2026-09-27T10:20:58+0530"
    }
  ]
}
