{
  "schema_version": 4,
  "date": "2026-10-04T09:00:00+05:30",
  "edition_no": 1,
  "strapline": "ಕರಾವಳಿ ದಿನಪತ್ರಿಕೆ",
  "stories": [
    {
      "segment": "saara",
      "photo_plan": "",
      "headline": "ಬೈಂದೂರು: ಮಳೆ ಕೊರತೆಯಿಂದ ತಾಲೂಕು ಅಧಿಕೃತವಾಗಿ ಬರಪೀಡಿತ ಘೋಷಣೆ",
      "category": "farm",
      "deck": "ಕರಾವಳಿಯಲ್ಲಿ ಮುಂಗಾರು ಮಳೆ ಕೈಕೊಟ್ಟು ನೀರಿನ ಅಭಾವ ತಲೆದೋರಿರುವ ಹಿನ್ನೆಲೆಯಲ್ಲಿ ಬೈಂದೂರು ತಾಲೂಕನ್ನು ರಾಜ್ಯ ಸರಕಾರ ಅಧಿಕೃತವಾಗಿ ಬರಪೀಡಿತ ತಾಲೂಕು ಎಂದು ಘೋಷಿಸಿದೆ.",
      "points": [
        "ವಾಡಿಕೆಗಿಂತ ಶೇಕಡಾ 45ಕ್ಕೂ ಹೆಚ್ಚು ಮಳೆ ಕೊರತೆ ದಾಖಲಾಗಿದ್ದು, ಗ್ರಾಮೀಣ ಬಾವಿ ಮತ್ತು ಕೊಳವೆಬಾವಿಗಳಲ್ಲಿ ಅಂತರ್ಜಲ ಕುಸಿತ ದೃಢಪಟ್ಟಿದೆ.",
        "ಹಳ್ಳಿಗಳಿಗೆ ಟ್ಯಾಂಕರ್ ಮೂಲಕ ಕುಡಿಯುವ ನೀರು ಪೂರೈಕೆ ಹಾಗೂ ಜಾನುವಾರುಗಳಿಗೆ ಮೇವಿನ ಬ್ಯಾಂಕ್ ಸ್ಥಾಪಿಸಲು ಜಿಲ್ಲಾಡಳಿತ ಆದೇಶಿಸಿದೆ.",
        "ಕೃಷಿ ಹಾನಿ ಸಮೀಕ್ಷೆ ನಡೆಸಿ ಸಂಕಷ್ಟದಲ್ಲಿರುವ ರೈತರಿಗೆ ಅಗತ್ಯ ಪರಿಹಾರ ಒದಗಿಸಲು ಕಂದಾಯ ಇಲಾಖೆ ಅಧಿಕಾರಿಗಳು ಗ್ರಾಮ ಮಟ್ಟದ ಪರಿಶೀಲನೆ ಆರಂಭಿಸಿದ್ದಾರೆ."
      ],
      "takeaway": "ಕುಡಿಯುವ ನೀರಿನ ಸಮಸ್ಯೆ ಮತ್ತು ಬೆಳೆ ಹಾನಿ ಪರಿಹಾರಕ್ಕೆ ರೈತರು ಗ್ರಾಮ ಪಂಚಾಯಿತಿ ಅಥವಾ ಕಂದಾಯ ಅಧಿಕಾರಿಗಳನ್ನು ಸಂಪರ್ಕಿಸಬಹುದು.",
      "location": "ಬೈಂದೂರು",
      "sources": [
        "ಉದಯವಾಣಿ"
      ],
      "source_urls": [
        "https://udayavani.com/udupi-news/siddapura-assault-at-shedimane-counter-complaints-filed-957954?lang=kn"
      ],
      "status": "confirmed",
      "published_at": "2026-10-04T09:15:00+05:30",
      "verified_by": "Gautam Paduvari",
      "verified_at": "2026-10-04T11:33:15+0530"
    },
    {
      "segment": "saara",
      "photo_plan": "",
      "headline": "ಕುಂದಾಪುರ: ಗೂಡ್ಸ್ ವಾಹನ ಡಿಕ್ಕಿಯಾಗಿ ಬೈಕ್ ಸವಾರರಿಗೆ ಗಂಭೀರ ಗಾಯ",
      "category": "accident",
      "deck": "ಕುಂದಾಪುರ ನಗರದ ಮುಖ್ಯ ರಸ್ತೆಯಲ್ಲಿ ಅತಿವೇಗವಾಗಿ ಬಂದ ಗೂಡ್ಸ್ ವಾಹನವು ದ್ವಿಚಕ್ರ ವಾಹನಕ್ಕೆ ಹಿಂಬದಿಯಿಂದ ಡಿಕ್ಕಿ ಹೊಡೆದ ಪರಿಣಾಮ ಬೈಕ್ ಸವಾರರು ಗಂಭೀರವಾಗಿ ಗಾಯಗೊಂಡಿದ್ದಾರೆ.",
      "points": [
        "ಡಿಕ್ಕಿಯ ರಭಸಕ್ಕೆ ಸವಾರರು ರಸ್ತೆಗೆ ಎಸೆಯಲ್ಪಟ್ಟು ಗಾಯಗೊಂಡಿದ್ದು, ಸ್ಥಳೀಯರು ತಕ್ಷಣವೇ ಕುಂದಾಪುರ ತಾಲೂಕು ಸರಕಾರಿ ಆಸ್ಪತ್ರೆಗೆ ದಾಖಲಿಸಿದ್ದಾರೆ.",
        "ಅಪಘಾತದಿಂದ ಕೆಲಕಾಲ ಸಂಚಾರ ಅಸ್ತವ್ಯಸ್ತಗೊಂಡಿದ್ದು, ಸಂಚಾರ ಠಾಣೆ ಪೊಲೀಸರು ಸ್ಥಳಕ್ಕೆ ಧಾವಿಸಿ ವಾಹನಗಳನ್ನು ತೆರವುಗೊಳಿಸಿದ್ದಾರೆ.",
        "ಸರಕು ವಾಹನ ಚಾಲಕನ ನಿರ್ಲಕ್ಷ್ಯದ ಚಾಲನೆ ವಿರುದ್ಧ ಕುಂದಾಪುರ ಸಂಚಾರ ಆರಕ್ಷಕ ಠಾಣೆಯಲ್ಲಿ ಪ್ರಕರಣ ದಾಖಲಾಗಿದೆ."
      ],
      "takeaway": "ನಗರದ ಮುಖ್ಯ ರಸ್ತೆಯಲ್ಲಿ ವಾಹನಗಳ ಅತಿವೇಗ ನಿಯಂತ್ರಿಸಲು ಸಂಚಾರ ಪೊಲೀಸರು ಕಟ್ಟುನಿಟ್ಟಿನ ಕ್ರಮ ಕೈಗೊಂಡಿದ್ದಾರೆ.",
      "location": "ಕುಂದಾಪುರ",
      "sources": [
        "ಉದಯವಾಣಿ"
      ],
      "source_urls": [
        "https://udayavani.com/udupi-news/kundapura-goods-vehicle-collision-bike-riders-injured-062803?lang=kn"
      ],
      "status": "confirmed",
      "published_at": "2026-10-04T09:30:00+05:30",
      "verified_by": "Gautam Paduvari",
      "verified_at": "2026-10-04T11:33:15+0530"
    },
    {
      "segment": "saara",
      "photo_plan": "",
      "headline": "ಕುಂದಾಪುರ: ಶೇಡಿಮನೆಯಲ್ಲಿ ಮಾರಾಮಾರಿ, ಪರಸ್ಪರ ಹಲ್ಲೆ ಆರೋಪದಡಿ ಪ್ರಕರಣ ದಾಖಲು",
      "category": "crime",
      "deck": "ಸಿದ್ದಾಪುರ ಸಮೀಪದ ಶೇಡಿಮನೆ ಗ್ರಾಮದಲ್ಲಿ ಹಳೆಯ ವೈಷಮ್ಯದ ಹಿನ್ನೆಲೆಯಲ್ಲಿ ಎರಡು ಗುಂಪುಗಳ ನಡುವೆ ಗಲಾಟೆ ನಡೆದಿದ್ದು, ಪರಸ್ಪರ ಹಲ್ಲೆ ಆರೋಪದಡಿ ಸಿದ್ದಾಪುರ ಠಾಣೆಯಲ್ಲಿ ದೂರು-ಪ್ರತಿದೂರು ದಾಖಲಾಗಿದೆ.",
      "points": [
        "ಸಾರ್ವಜನಿಕ ಸ್ಥಳದಲ್ಲಿ ಕಲ್ಲು ಮತ್ತು ದೊಣ್ಣೆಗಳಿಂದ ಪರಸ್ಪರ ಹಲ್ಲೆ ನಡೆಸಿದ ಆರೋಪ ಕೇಳಿಬಂದಿದ್ದು, ಎರಡೂ ಕಡೆಯ ಹಲವರು ಗಾಯಗೊಂಡಿದ್ದಾರೆ.",
        "ಕೌಟುಂಬಿಕ ಹಾಗೂ ಜಾಗದ ವಿವಾದವೇ ಗಲಾಟೆಗೆ ಕಾರಣವೆನ್ನಲಾಗಿದ್ದು, ಉಭಯ ಬಣಗಳ ದೂರಿನ ಅನ್ವಯ ಪೊಲೀಸರು ಪ್ರತ್ಯೇಕ ಎಫ್.ಐ.ಆರ್ ದಾಖಲಿಸಿಕೊಂಡಿದ್ದಾರೆ.",
        "ಗ್ರಾಮದಲ್ಲಿ ಶಾಂತಿ ಸುವ್ಯವಸ್ಥೆ ಕಾಪಾಡಲು ಪೊಲೀಸರು ಮುನ್ನೆಚ್ಚರಿಕೆ ಕ್ರಮ ಕೈಗೊಂಡಿದ್ದು, ಕಟ್ಟುನಿಟ್ಟಿನ ನಿಗಾ ಇರಿಸಿದ್ದಾರೆ."
      ],
      "takeaway": "ಗ್ರಾಮದಲ್ಲಿ ಉದ್ವಿಗ್ನತೆ ಶಮನಕ್ಕೆ ಪೊಲೀಸರು ನಿಗಾ ಇರಿಸಿದ್ದು, ಸಾರ್ವಜನಿಕರು ಶಾಂತಿ ಕಾಪಾಡುವಂತೆ ಮನವಿ ಮಾಡಿದ್ದಾರೆ.",
      "location": "ಕುಂದಾಪುರ",
      "sources": [
        "ಉದಯವಾಣಿ"
      ],
      "source_urls": [
        "https://udayavani.com/udupi-news/siddapura-assault-at-shedimane-counter-complaints-filed-957954?lang=kn"
      ],
      "status": "confirmed",
      "published_at": "2026-10-04T09:45:00+05:30",
      "verified_by": "Gautam Paduvari",
      "verified_at": "2026-10-04T11:33:15+0530"
    },
    {
      "segment": "saara",
      "photo_plan": "",
      "headline": "ಹೆಬ್ರಿ: ಆಗುಂಬೆ ಘಾಟಿಯಲ್ಲಿ ಕಂದಕಕ್ಕೆ ಉರುಳಿದ ಲಾರಿ, ಚಾಲಕನ ಸಾಹಸಮಯ ರಕ್ಷಣೆ",
      "category": "accident",
      "deck": "ಆಗುಂಬೆ ಘಾಟಿಯ 7ನೇ ತಿರುವಿನಲ್ಲಿ ಸರಕು ತುಂಬಿದ್ದ ಲಾರಿ 100 ಅಡಿ ಕಂದಕಕ್ಕೆ ಉರುಳಿ ಬಿದ್ದಿದ್ದು, 3 ಗಂಟೆಗಳ ಕಾಲ ಕ್ಯಾಬಿನ್‌ನಲ್ಲಿ ಸಿಲುಕಿದ್ದ ಚಾಲಕನನ್ನು ರಕ್ಷಣಾ ತಂಡಗಳು ಜೀವಂತವಾಗಿ ರಕ್ಷಿಸಿವೆ.",
      "points": [
        "ವಾಹನದ ಮುಂಭಾಗ ಬಂಡೆಕಲ್ಲುಗಳಿಗೆ ಅಪ್ಪಳಿಸಿ ನಜ್ಜುಗುಜ್ಜಾಗಿದ್ದರಿಂದ ಚಾಲಕನ ಎರಡೂ ಕಾಲುಗಳು ಸಿಲುಕಿಕೊಂಡು ತೀವ್ರ ರಕ್ತಸ್ರಾವ ಉಂಟಾಗಿತ್ತು.",
        "ಸೋಮೇಶ್ವರ-ಹೆಬ್ರಿ ಪೊಲೀಸರು, ಅರಣ್ಯ ಇಲಾಖೆ ಸಿಬ್ಬಂದಿ ಹಾಗೂ ಸ್ಥಳೀಯ ಆಪತ್ಬಾಂಧವರು ಗ್ಯಾಸ್ ಕಟ್ಟರ್ ಬಳಸಿ ಕ್ಯಾಬಿನ್ ಕತ್ತರಿಸಿ ಚಾಲಕನನ್ನು ರಕ್ಷಿಸಿದ್ದಾರೆ.",
        "ಗಾಯಾಳು ಚಾಲಕನನ್ನು ಮಣಿಪಾಲದ ಆಸ್ಪತ್ರೆಗೆ ರವಾನಿಸಲಾಗಿದ್ದು, ಪ್ರಾಣಾಪಾಯದಿಂದ ಪಾರಾಗಿದ್ದಾರೆ ಎಂದು ವೈದ್ಯರು ತಿಳಿಸಿದ್ದಾರೆ."
      ],
      "takeaway": "ಆಗುಂಬೆ ಘಾಟಿಯ ಕಡಿದಾದ ತಿರುವುಗಳಲ್ಲಿ ವಾಹನ ಚಾಲಕರು ಎಚ್ಚರಿಕೆ ವಹಿಸಲು ಮತ್ತು ನಿಯಂತ್ರಿತ ವೇಗದಲ್ಲಿ ಚಲಿಸಲು ಸೂಚಿಸಲಾಗಿದೆ.",
      "location": "ಹೆಬ್ರಿ",
      "sources": [
        "ಉದಯವಾಣಿ"
      ],
      "source_urls": [
        "https://udayavani.com/udupi-news/agumbe-ghati-a-lorry-rolled-into-a-ditch-099579?lang=kn"
      ],
      "status": "confirmed",
      "published_at": "2026-10-04T10:00:00+05:30",
      "verified_by": "Gautam Paduvari",
      "verified_at": "2026-10-04T11:33:15+0530"
    },
    {
      "segment": "saara",
      "photo_plan": "",
      "headline": "ಕುಂದಾಪುರ: ತೆಕ್ಕಟ್ಟೆಯ ಶಿಕ್ಷಣ ತಜ್ಞೆ ಡಾ. ಪ್ರಮೀಳಾ ವಾಜ್ ಅಸೌಖ್ಯದಿಂದ ನಿಧನ",
      "category": "obituary",
      "deck": "ಕುಂದಾಪುರ ತಾಲೂಕಿನ ತೆಕ್ಕಟ್ಟೆಯ ಖ್ಯಾತ ಶಿಕ್ಷಣ ತಜ್ಞೆ, ಮಕ್ಕಳ ಹಕ್ಕುಗಳ ಹೋರಾಟಗಾರ್ತಿ ಹಾಗೂ ನಿವೃತ್ತ ಹಿರಿಯ ಉಪನ್ಯಾಸಕಿ ಡಾ. ಪ್ರಮೀಳಾ ವಾಜ್ (60) ದೀರ್ಘಕಾಲದ ಅಸೌಖ್ಯದಿಂದ ನಿಧನರಾಗಿದ್ದಾರೆ.",
      "points": [
        "ಉನ್ನತ ಶಿಕ್ಷಣ ಕ್ಷೇತ್ರದಲ್ಲಿ 4 ದಶಕಗಳ ಕಾಲ ಪ್ರಾಧ್ಯಾಪಕರಾಗಿ ಸೇವೆ ಸಲ್ಲಿಸಿ, ಸಾವಿರಾರು ಗ್ರಾಮೀಣ ವಿದ್ಯಾರ್ಥಿಗಳಿಗೆ ಮಾರ್ಗದರ್ಶನ ನೀಡಿದ್ದರು.",
        "ಅಸಹಾಯಕ ಹೆಣ್ಣುಮಕ್ಕಳ ರಕ್ಷಣೆ ಮತ್ತು ಸಾಮಾಜಿಕ ಸೇವಾ ಚಟುವಟಿಕೆಗಳಲ್ಲಿ ಹಾಗೂ ಸ್ಥಳೀಯ ಶೈಕ್ಷಣಿಕ-ಸಾಂಸ್ಕೃತಿಕ ಕಾರ್ಯಕ್ರಮಗಳಲ್ಲಿ ಸಕ್ರಿಯರಾಗಿದ್ದರು.",
        "ಡಾ. ಪ್ರಮೀಳಾ ವಾಜ್ ಅವರ ನಿಧನಕ್ಕೆ ಸ್ಥಳೀಯ ನಾಗರಿಕರು, ಶಿಕ್ಷಕ ವೃಂದ, ಜನಪ್ರತಿನಿಧಿಗಳು ಹಾಗೂ ಅಪಾರ ಶಿಷ್ಯವರ್ಗ ತೀವ್ರ ಸಂತಾಪ ವ್ಯಕ್ತಪಡಿಸಿದೆ."
      ],
      "takeaway": "ಮೃತರ ಅಂತ್ಯಕ್ರಿಯೆಯು ಕುಟುಂಬಸ್ಥರು ಮತ್ತು ಸಾರ್ವಜನಿಕರ ಸಮ್ಮುಖದಲ್ಲಿ ತೆಕ್ಕಟ್ಟೆಯಲ್ಲಿ ನೆರವೇರಿತು.",
      "location": "ಕುಂದಾಪುರ",
      "sources": [
        "ಉದಯವಾಣಿ",
        "ಊರ್ಮನಿ ಸುದ್ದಿ ಸ್ಥಳ ವರದಿ"
      ],
      "source_urls": [
        "https://udayavani.com/udupi-news/thekkatte-lecturer-dr-pramila-vaj-passed-away-312912?lang=kn"
      ],
      "status": "confirmed",
      "published_at": "2026-10-04T10:15:00+05:30",
      "verified_by": "Gautam Paduvari",
      "verified_at": "2026-10-04T11:33:15+0530"
    },
    {
      "segment": "saara",
      "photo_plan": "",
      "headline": "ಕೋಟ: ಕಾರಂತ ಪಾರ್ಕ್‌ನ 75 ಲಕ್ಷ ರೂ. ವೆಚ್ಚದ ಸಂಗೀತ ಕಾರಂಜಿ 3 ದಿನಕ್ಕೆ ಸ್ಥಗಿತ",
      "category": "civic",
      "deck": "ಕೋಟದ ಡಾ. ಶಿವರಾಮ ಕಾರಂತ ಥೀಮ್ ಪಾರ್ಕ್‌ನಲ್ಲಿ ಸುಮಾರು 75 ಲಕ್ಷ ರೂಪಾಯಿ ವೆಚ್ಚದಲ್ಲಿ ನಿರ್ಮಿಸಲಾಗಿದ್ದ ಸಂಗೀತ ಕಾರಂಜಿಯು ಉದ್ಘಾಟನೆಯಾದ 3 ದಿನಗಳಲ್ಲಿ ಕೆಟ್ಟು ನಿಂತಿದ್ದು, ಸಾರ್ವಜನಿಕ ಆಕ್ರೋಶ ವ್ಯಕ್ತವಾಗಿದೆ.",
      "points": [
        "ಕಾರಂತರ ಜನ್ಮದಿನೋತ್ಸವಕ್ಕೆ ಸಾವಿರಾರು ಪ್ರವಾಸಿಗರು ಭೇಟಿ ನೀಡುತ್ತಿದ್ದು, ಕಾರಂಜಿ ಸ್ಥಗಿತಗೊಂಡಿರುವುದು ಅಧಿಕಾರಿಗಳ ನಿರ್ಲಕ್ಷ್ಯಕ್ಕೆ ಸಾಕ್ಷಿ ಎಂದು ಸ್ಥಳೀಯರು ಆರೋಪಿಸಿದ್ದಾರೆ.",
        "ಕಳಪೆ ಗುಣಮಟ್ಟದ ವಿದ್ಯುತ್ ಉಪಕರಣ ಅಳವಡಿಕೆ ಕಾರಣವೆನ್ನಲಾಗಿದ್ದು, ಕಾಮಗಾರಿ ಕುರಿತು ಸಮಗ್ರ ತಾಂತ್ರಿಕ ತನಿಖೆ ನಡೆಸಬೇಕೆಂದು ಸಾರ್ವಜನಿಕರು ಒತ್ತಾಯಿಸಿದ್ದಾರೆ.",
        "ಕಾರಂತ ಪ್ರತಿಷ್ಠಾನ ಹಾಗೂ ಪ್ರವಾಸೋದ್ಯಮ ಇಲಾಖೆ ಸಂಬಂಧಪಟ್ಟ ಗುತ್ತಿಗೆದಾರರ ವಿರುದ್ಧ ಕಠಿಣ ಕ್ರಮ ಕೈಗೊಂಡು ಕಾರಂಜಿ ಪುನರಾರಂಭಿಸಲು ಸ್ಥಳೀಯರು ಆಗ್ರಹಿಸಿದ್ದಾರೆ."
      ],
      "takeaway": "ಕಾರಂಜಿಯ ದುರಸ್ತಿ ಮತ್ತು ತಾಂತ್ರಿಕ ತನಿಖೆ ಕುರಿತು ಕಾರಂತ ಪ್ರತಿಷ್ಠಾನ ಹಾಗೂ ಪ್ರವಾಸೋದ್ಯಮ ಇಲಾಖೆಯಿಂದ ಶೀಘ್ರ ಕ್ರಮ ನಿರೀಕ್ಷಿಸಲಾಗಿದೆ.",
      "location": "ಕೋಟ",
      "sources": [
        "ಉದಯವಾಣಿ"
      ],
      "source_urls": [
        "https://udayavani.com/udupi-news/kotas-karanth-theme-park-the-indian-rupee75-lakh-fountain-working-for-just-three-days-151772?lang=kn"
      ],
      "status": "confirmed",
      "published_at": "2026-10-04T10:30:00+05:30",
      "verified_by": "Gautam Paduvari",
      "verified_at": "2026-10-04T11:33:15+0530"
    }
  ]
}
