{
  "schema_version": 4,
  "date": "2026-09-29T09:00:00+05:30",
  "edition_no": 1,
  "strapline": "ಕರಾವಳಿ ದಿನಪತ್ರಿಕೆ",
  "stories": [
    {
      "segment": "saara",
      "photo_plan": "",
      "headline": "ಕುಂದಾಪುರ-ಬೈಂದೂರು: ಬೆಂಗಳೂರು-ಮಡಗಾಂವ್ ಹಬ್ಬದ ವಿಶೇಷ ರೈಲು ಪ್ರಕಟ",
      "category": "civic",
      "deck": "ಗಾಂಧಿ ಜಯಂತಿ ಹಾಗೂ ಸಾಲು ರಜೆಗಳ ಹಿನ್ನೆಲೆಯಲ್ಲಿ ನೈರುತ್ಯ ರೈಲ್ವೆಯು ಬೆಂಗಳೂರು ಕಂಟೋನ್ಮೆಂಟ್ ಮತ್ತು ಮಡಗಾಂವ್ ನಡುವೆ ಕರಾವಳಿ ಮಾರ್ಗದ ವಿಶೇಷ ಎಕ್ಸ್ಪ್ರೆಸ್ ರೈಲು ಸಂಚಾರವನ್ನು ಅಧಿಕೃತವಾಗಿ ಪ್ರಕಟಿಸಿದೆ.",
      "points": [
        "ಅಕ್ಟೋಬರ್ ೧ರ ರಾತ್ರಿ ಬೆಂಗಳೂರಿನಿಂದ ನಿರ್ಗಮಿಸಿ ಬಾರ್ಕೂರು, ಕುಂದಾಪುರ, ಮೂಕಾಂಬಿಕಾ ರೋಡ್ ಬೈಂದೂರು ನಿಲ್ದಾಣಗಳಲ್ಲಿ ನಿಗದಿತ ನಿಲುಗಡೆ ಹೊಂದಿ ಮಡಗಾಂವ್ ತಲುಪಲಿದೆ.",
        "ಮರಳಿ ಅಕ್ಟೋಬರ್ ೪ ರಂದು ಗೋವಾದಿಂದ ಹೊರಟು ಇದೇ ಮಾರ್ಗದಲ್ಲಿ ಬೆಂಗಳೂರಿಗೆ ಹಿಂತಿರುಗಲಿದೆ.",
        "ಕರಾವಳಿ ಭಾಗದ ನೂರಾರು ಯಾತ್ರಿಕರು ಹಾಗೂ ಬೆಂಗಳೂರಿನಲ್ಲಿ ನೆಲೆಸಿರುವ ಜನರಿಗೆ ಈ ಹಬ್ಬದ ವಿಶೇಷ ರೈಲು ಸೇವೆಯಿಂದ ಅನುಕೂಲವಾಗಲಿದೆ."
      ],
      "takeaway": "ಕರಾವಳಿ ಭಾಗದ ಪ್ರಯಾಣಿಕರ ಬಹುಕಾಲದ ಬೇಡಿಕೆಯನ್ನು ಪರಿಗಣಿಸಿ ರೈಲ್ವೆ ಇಲಾಖೆಯು ಈ ಹೆಚ್ಚುವರಿ ಸೇವೆಯನ್ನು ಕಲ್ಪಿಸಿದೆ ಎಂದು ಅಧಿಕಾರಿಗಳು ತಿಳಿಸಿದ್ದಾರೆ.",
      "location": "ಕುಂದಾಪುರ",
      "sources": [
        "ವಿಜಯ ಕರ್ನಾಟಕ"
      ],
      "source_urls": [
        "https://vijaykarnataka.com/news/karnataka/3-day-long-weekend-special-train-service-launched-between-bengaluru-udupi-madgaon-benefits-6-districts-schedule-released/articleshow/134544030.cms"
      ],
      "status": "official",
      "published_at": "2026-09-29T08:30:00+05:30",
      "verified_by": "Goutham",
      "verified_at": "2026-09-29T09:58:10+0530"
    },
    {
      "segment": "saara",
      "photo_plan": "",
      "headline": "ಗಂಗೊಳ್ಳಿ-ಕುಂದಾಪುರ: ದಾಖಲೆ ಪ್ರಮಾಣದ ಬೂತಾಯಿ ಮೀನು ಲಭ್ಯ, ಬೆಲೆ ಇಳಿಕೆ",
      "category": "fisheries",
      "deck": "ಕರಾವಳಿ ತೀರದ ನೂತನ ಮೀನುಗಾರಿಕಾ ಋತುವಿನ ಆರಂಭಿಕ ಹಂತದಲ್ಲೇ ಗಂಗೊಳ್ಳಿ, ಕೋಡಿ ಹಾಗೂ ಮರವಂತೆ ಬಂದರು ವ್ಯಾಪ್ತಿಯಲ್ಲಿ ನಾಡದೋಣಿ-ಬೋಟುಗಳಿಗೆ ದಾಖಲೆ ಪ್ರಮಾಣದ ಬೂತಾಯಿ ಮೀನುಗಳು ಲಭ್ಯವಾಗುತ್ತಿವೆ.",
      "points": [
        "ಕಡಲಲ್ಲಿ ಅಪಾರ ಪ್ರಮಾಣದ ಮೀನಿನ ಹಿಂಡು ಕಂಡುಬರುತ್ತಿರುವುದರಿಂದ ಸ್ಥಳೀಯ ಚಿಲ್ಲರೆ ಮಾರುಕಟ್ಟೆಗಳಲ್ಲಿ ಬೂತಾಯಿ ಮೀನಿನ ಧಾರಣೆಯು ಗಣನೀಯವಾಗಿ ಇಳಿಕೆಯಾಗಿದೆ.",
        "ಸ್ಥಳೀಯ ಮೀನೆಣ್ಣೆ ಮತ್ತು ಫಿಶ್ಮೀಲ್ ಕಾರ್ಖಾನೆಗಳಿಗೂ ದಿನಂಪ್ರತಿ ನೂರಾರು ಟನ್ ಕಚ್ಚಾ ಮೀನು ಪೂರೈಕೆಯಾಗುತ್ತಿದ್ದು ಕಾರ್ಖಾನೆಗಳು ಸಕ್ರಿಯವಾಗಿವೆ.",
        "ದೀರ್ಘಾವಧಿಯ ಮಳೆಗಾಲದ ನಿಷೇಧದ ಬಳಿಕ ಕರಾವಳಿ ಮೀನುಗಾರರ ಆರ್ಥಿಕ ಸ್ಥಿತಿಯಲ್ಲಿ ಚೇತರಿಕೆಯ ಆಶಾವಾದ ಮೂಡಿದೆ."
      ],
      "takeaway": "ಗ್ರಾಹಕರಿಗೆ ಅತ್ಯಂತ ಕಡಿಮೆ ಬೆಲೆಗೆ ತಾಜಾ ಮೀನು ಸಿಗುವಂತಾಗಿದ್ದು, ಮೀನುಗಾರರ ಆರ್ಥಿಕ ಸ್ಥಿತಿಯಲ್ಲಿ ಚೇತರಿಕೆಯ ಆಶಾವಾದ ಮೂಡಿದೆ.",
      "location": "ಕುಂದಾಪುರ",
      "sources": [
        "ಉದಯವಾಣಿ"
      ],
      "source_urls": [
        "https://udayavani.com/udupi-news/good-fishing-at-the-start-of-the-season-increase-in-sardine-catch-907055?lang=kn"
      ],
      "status": "confirmed",
      "published_at": "2026-09-29T08:35:00+05:30",
      "verified_by": "Goutham",
      "verified_at": "2026-09-29T09:58:10+0530"
    },
    {
      "segment": "saara",
      "photo_plan": "",
      "headline": "ಕುಂದಾಪುರ: ನಿಧಾನವಾಗಿ ಮಾತನಾಡುವಂತೆ ಹೇಳಿದ್ದಕ್ಕೆ ಬಾಟಲಿ ಹಲ್ಲೆ ಆರೋಪ, ಪ್ರಕರಣ ದಾಖಲು",
      "category": "crime",
      "deck": "ಕುಂದಾಪುರ ಪುರಸಭಾ ವ್ಯಾಪ್ತಿಯಲ್ಲಿ ಜೋರಾಗಿ ಗದ್ದಲ ಮಾಡುತ್ತಿದ್ದ ವ್ಯಕ್ತಿಗೆ ನಿಧಾನವಾಗಿ ಮಾತನಾಡುವಂತೆ ಹೇಳಿದ್ದಕ್ಕೆ ಗಾಜಿನ ಬಾಟಲಿಯಿಂದ ಹಲ್ಲೆ ನಡೆಸಿ ಕೊಲೆ ಬೆದರಿಕೆ ಹಾಕಿದ ಆರೋಪದಡಿ ಪ್ರಕರಣ ದಾಖಲಾಗಿದೆ.",
      "points": [
        "ಸಾರ್ವಜನಿಕ ಸ್ಥಳದಲ್ಲಿ ನಿಂತು ಅಸಭ್ಯವಾಗಿ ವರ್ತಿಸುತ್ತಿದ್ದನ್ನು ಪ್ರಶ್ನಿಸಿದ್ದಕ್ಕೆ ವ್ಯಕ್ತಿಯೊಬ್ಬರ ಮೇಲೆ ಮಾರಣಾಂತಿಕ ಹಲ್ಲೆ ನಡೆಸಿದ ಆರೋಪ ಕೇಳಿಬಂದಿದೆ.",
        "ಹಲ್ಲೆಗೊಳಗಾದ ಗಾಯಾಳು ವ್ಯಕ್ತಿಯನ್ನು ಸ್ಥಳೀಯರು ರಕ್ಷಿಸಿ ಕುಂದಾಪುರದ ಸಾರ್ವಜನಿಕ ಆಸ್ಪತ್ರೆಗೆ ದಾಖಲಿಸಿ ತುರ್ತು ಚಿಕಿತ್ಸೆ ಒದಗಿಸಿದ್ದಾರೆ.",
        "ಸಂತ್ರಸ್ತರು ನೀಡಿದ ದೂರಿನನ್ವಯ ಕುಂದಾಪುರ ನಗರ ಆರಕ್ಷಕ ಠಾಣೆಯಲ್ಲಿ ಭಾರತೀಯ ನ್ಯಾಯ ಸಂಹಿತೆಯ ವಿವಿಧ ಕಲಂ ಅಡಿಯಲ್ಲಿ ಕ್ರಿಮಿನಲ್ ಪ್ರಕರಣ ದಾಖಲಾಗಿದೆ."
      ],
      "takeaway": "ಪೊಲೀಸರು ಘಟನಾ ಸ್ಥಳಕ್ಕೆ ಭೇಟಿ ನೀಡಿ ಮಹಜರು ನಡೆಸಿದ್ದು, ತಲೆಮರೆಸಿಕೊಂಡಿರುವ ಆರೋಪಿಯ ಪತ್ತೆಗೆ ತನಿಖೆ ಚುರುಕುಗೊಳಿಸಿದ್ದಾರೆ.",
      "location": "ಕುಂದಾಪುರ",
      "sources": [
        "ಉದಯವಾಣಿ"
      ],
      "source_urls": [
        "https://udayavani.com/udupi-news/kundapura-assault-glass-bottle-threat-speak-softly-216659?lang=kn"
      ],
      "status": "confirmed",
      "published_at": "2026-09-29T08:40:00+05:30",
      "verified_by": "Goutham",
      "verified_at": "2026-09-29T09:58:10+0530"
    },
    {
      "segment": "saara",
      "photo_plan": "",
      "headline": "ಬ್ರಹ್ಮಾವರ: ರಾಷ್ಟ್ರೀಯ ಹೆದ್ದಾರಿ ೬೬ ರಲ್ಲಿ ಕಾರು ಢಿಕ್ಕಿ, ಒಡಿಶಾ ಮೂಲದ ಕಾರ್ಮಿಕ ಸಾವು",
      "category": "accident",
      "deck": "ಬ್ರಹ್ಮಾವರ ಪೊಲೀಸ್ ಠಾಣಾ ವ್ಯಾಪ್ತಿಯ ರಾಷ್ಟ್ರೀಯ ಹೆದ್ದಾರಿ ೬೬ ರಲ್ಲಿ ರಸ್ತೆ ದಾಟುತ್ತಿದ್ದ ಸಂದರ್ಭದಲ್ಲಿ ಕಾರೊಂದು ಢಿಕ್ಕಿ ಹೊಡೆದ ಪರಿಣಾಮ ಒಡಿಶಾ ಮೂಲದ ವಲಸೆ ಕಾರ್ಮಿಕರೊಬ್ಬರು ಸಾವನ್ನಪ್ಪಿದ್ದಾರೆ.",
      "points": [
        "ಅಪಘಾತದ ರಭಸಕ್ಕೆ ಹೆದ್ದಾರಿಯ ಡಾಂಬರು ರಸ್ತೆಗೆ ಬಿದ್ದು ತಲೆ ಮತ್ತು ಎದೆಗೆ ಮಾರಣಾಂತಿಕ ಪೆಟ್ಟು ತಗುಲಿದ್ದು, ಸ್ಥಳೀಯರು ಆಸ್ಪತ್ರೆಗೆ ಸಾಗಿಸಿದರೂ ಪ್ರಾಣಪಕ್ಷಿ ಹಾರಿಹೋಗಿದೆ.",
        "ಮೃತ ವ್ಯಕ್ತಿ ಬ್ರಹ್ಮಾವರ ಪರಿಸರದಲ್ಲಿ ಕೂಲಿ ಕಾರ್ಮಿಕನಾಗಿ ಕೆಲಸ ಮಾಡಿಕೊಂಡಿದ್ದು, ಪರಿಚಿತರು ನೀಡಿದ ದೂರಿನ ಮೇರೆಗೆ ಬ್ರಹ್ಮಾವರ ಠಾಣೆಯಲ್ಲಿ ಪ್ರಕರಣ ದಾಖಲಾಗಿದೆ.",
        "ಕಾರು ಚಾಲಕನ ಅಜಾಗರೂಕ ಚಾಲನೆಯೇ ಅವಘಡಕ್ಕೆ ಕಾರಣವೆನ್ನಲಾಗಿದ್ದು, ಮರಣೋತ್ತರ ಪರೀಕ್ಷೆಯ ಬಳಿಕ ಮೃತದೇಹವನ್ನು ಶವಾಗಾರದಲ್ಲಿ ಇರಿಸಲಾಗಿದೆ."
      ],
      "takeaway": "ಘಟನೆಯ ಸಂಬಂಧ ಮೃತರ ಪರಿಚಿತರು ನೀಡಿದ ದೂರಿನ ಮೇರೆಗೆ ಬ್ರಹ್ಮಾವರ ಆರಕ್ಷಕ ಠಾಣೆಯಲ್ಲಿ ಪ್ರಕರಣ ದಾಖಲಾಗಿದೆ.",
      "location": "ಬ್ರಹ್ಮಾವರ",
      "sources": [
        "ಉದಯವಾಣಿ"
      ],
      "source_urls": [
        "https://udayavani.com/udupi-news/brahmavar-worker-from-odisha-after-being-hit-by-a-car-167624?lang=kn"
      ],
      "status": "confirmed",
      "published_at": "2026-09-29T08:45:00+05:30",
      "verified_by": "Goutham",
      "verified_at": "2026-09-29T09:58:10+0530"
    },
    {
      "segment": "saara",
      "photo_plan": "",
      "headline": "ಕೋಟ: ಹೆದ್ದಾರಿ ಬದಿಯಲ್ಲಿ ಅಸ್ವಸ್ಥ ಸ್ಥಿತಿಯಲ್ಲಿದ್ದ ಒಡಿಶಾದ ಯುವಕನ ರಕ್ಷಣೆ",
      "category": "civic",
      "deck": "ಕೋಟ ಪೊಲೀಸ್ ಠಾಣಾ ವ್ಯಾಪ್ತಿಯ ರಾಷ್ಟ್ರೀಯ ಹೆದ್ದಾರಿ ೬೬ ರ ಬದಿಯಲ್ಲಿ ತೀವ್ರ ಅಸ್ವಸ್ಥ ಹಾಗೂ ನಿಶ್ಯಕ್ತ ಸ್ಥಿತಿಯಲ್ಲಿ ಪತ್ತೆಯಾದ ಒಡಿಶಾ ಮೂಲದ ಅಪರಿಚಿತ ಯುವಕನನ್ನು ಸ್ಥಳೀಯರು ಹಾಗೂ ಪೊಲೀಸರು ರಕ್ಷಿಸಿದ್ದಾರೆ.",
      "points": [
        "ಆಹಾರ-ನೀರಿಲ್ಲದೆ ರಸ್ತೆ ಬದಿಯ ಪೊದೆಯ ಸಮೀಪ ಎದ್ದು ನಿಲ್ಲಲೂ ಶಕ್ತಿಯಿಲ್ಲದೆ ನರಳುತ್ತಿದ್ದ ಯುವಕನನ್ನು ಕಂಡ ಸಾರ್ವಜನಿಕರು ತಕ್ಷಣವೇ ಪೊಲೀಸ್ ಠಾಣೆಗೆ ಮಾಹಿತಿ ರವಾನಿಸಿದ್ದರು.",
        "ಸ್ಥಳಕ್ಕೆ ಧಾವಿಸಿದ ಕೋಟ ಪೊಲೀಸರು ಸಮಾಜಸೇವಕರ ನೆರವಿನೊಂದಿಗೆ ಯುವಕನಿಗೆ ಪ್ರಥಮ ಚಿಕಿತ್ಸೆ ಕೊಡಿಸಿ ಬ್ರಹ್ಮಾವರದ ಸಮುದಾಯ ಆರೋಗ್ಯ ಕೇಂದ್ರಕ್ಕೆ ದಾಖಲಿಸಿದ್ದಾರೆ.",
        "ಪ್ರಸ್ತುತ ಯುವಕ ಚಿಕಿತ್ಸೆಗೆ ಸ್ಪಂದಿಸುತ್ತಿದ್ದು, ಆತನ ಪೂರ್ಣ ಹೆಸರು ಹಾಗೂ ಒಡಿಶಾದ ವಿಳಾಸ ಪತ್ತೆ ಹಚ್ಚಿ ಕುಟುಂಬಸ್ಥರಿಗೆ ಒಪ್ಪಿಸಲು ಪೊಲೀಸರು ಕ್ರಮ ಕೈಗೊಂಡಿದ್ದಾರೆ."
      ],
      "takeaway": "ಸ್ಥಳಕ್ಕೆ ಧಾವಿಸಿದ ಕೋಟ ಪೊಲೀಸರು ಸಮಾಜಸೇವಕರ ನೆರವಿನೊಂದಿಗೆ ಯುವಕನಿಗೆ ಪ್ರಥಮ ಚಿಕಿತ್ಸೆ ಕೊಡಿಸಿ ಆಸ್ಪತ್ರೆಗೆ ದಾಖಲಿಸಿದ್ದಾರೆ.",
      "location": "ಕೋಟ",
      "sources": [
        "ಉದಯವಾಣಿ"
      ],
      "source_urls": [
        "https://udayavani.com/udupi-news/kota-rescue-young-manodisha-found-unwell-condition-069819?lang=kn"
      ],
      "status": "confirmed",
      "published_at": "2026-09-29T08:50:00+05:30",
      "verified_by": "Goutham",
      "verified_at": "2026-09-29T09:58:10+0530"
    },
    {
      "segment": "saara",
      "photo_plan": "",
      "headline": "ಬ್ರಹ್ಮಾವರ: ರಸ್ತೆ ಬದಿಯಲ್ಲಿ ವೃದ್ಧ ತಾಯಿಯನ್ನು ಬಿಟ್ಟು ಮಗ ಪರಾರಿ ಆರೋಪ, ರಕ್ಷಣೆ",
      "category": "crime",
      "deck": "ಬ್ರಹ್ಮಾವರ ಪಟ್ಟಣದ ನಿರ್ಜನ ರಸ್ತೆ ಬದಿಯಲ್ಲಿ ಹೆತ್ತ ವೃದ್ಧ ತಾಯಿಯನ್ನು ಮಗನೊಬ್ಬ ಅಮಾನವೀಯವಾಗಿ ಬಿಟ್ಟು ಪರಾರಿಯಾಗಿರುವ ಆರೋಪ ಕೇಳಿಬಂದಿದ್ದು, ಅಸಹಾಯಕ ವೃದ್ಧೆಯನ್ನು ಸ್ಥಳೀಯರು ರಕ್ಷಿಸಿದ್ದಾರೆ.",
      "points": [
        "ದಾರಿ ಕಾಣದೆ ಹಸಿವು ಮತ್ತು ಆತಂಕದಿಂದ ರಸ್ತೆಬದಿಯಲ್ಲೇ ಕುಳಿತು ಅಳುತ್ತಿದ್ದ ವೃದ್ಧೆಯನ್ನು ಗಮನಿಸಿದ ಸ್ಥಳೀಯರು ತಕ್ಷಣವೇ ಬ್ರಹ್ಮಾವರ ಪೊಲೀಸರಿಗೆ ಮಾಹಿತಿ ನೀಡಿದ್ದಾರೆ.",
        "ಸ್ಥಳಕ್ಕೆ ಧಾವಿಸಿದ ರಕ್ಷಣಾ ತಂಡವು ವೃದ್ಧೆಗೆ ಪ್ರೀತಿಯಿಂದ ಆಹಾರ ನೀಡಿ, ವೈದ್ಯಕೀಯ ತಪಾಸಣೆಯ ಬಳಿಕ ತಾತ್ಕಾಲಿಕವಾಗಿ ಪುನರ್ವಸತಿ ಆಸರೆ ಕೇಂದ್ರಕ್ಕೆ ದಾಖಲಿಸಿದೆ.",
        "ತಾಯಿಯನ್ನು ನಿರ್ದಯವಾಗಿ ಕೈಬಿಟ್ಟು ಹೋದ ಮಗನ ಸುಳಿವು ಪತ್ತೆಹಚ್ಚಲು ಹಾಗೂ ಆತನ ವಿರುದ್ಧ ಕಾನೂನು ಕ್ರಮ ಜರುಗಿಸಲು ಬ್ರಹ್ಮಾವರ ಪೊಲೀಸರು ವಿಚಾರಣೆ ಕೈಗೆತ್ತಿಕೊಂಡಿದ್ದಾರೆ."
      ],
      "takeaway": "ವೃದ್ಧ ತಾಯಿಯನ್ನು ಕೈಬಿಟ್ಟು ಹೋದ ಮಗನ ಸುಳಿವು ಪತ್ತೆಹಚ್ಚಲು ಪೊಲೀಸರು ವಿಚಾರಣೆ ಕೈಗೆತ್ತಿಕೊಂಡಿದ್ದಾರೆ.",
      "location": "ಬ್ರಹ್ಮಾವರ",
      "sources": [
        "ಉದಯವಾಣಿ"
      ],
      "source_urls": [
        "https://udayavani.com/udupi-news/son-abandons-motherunfamiliar-place-incidentbrahmavar-700037?lang=kn"
      ],
      "status": "confirmed",
      "published_at": "2026-09-29T08:55:00+05:30",
      "verified_by": "Goutham",
      "verified_at": "2026-09-29T09:58:10+0530"
    }
  ]
}
