{
  "schema_version": 4,
  "date": "2026-10-03T09:00:00+05:30",
  "edition_no": 1,
  "strapline": "ಕರಾವಳಿ ದಿನಪತ್ರಿಕೆ",
  "stories": [
    {
      "segment": "saara",
      "photo_plan": "",
      "headline": "ಕೊಲ್ಲೂರು: ದನ ಕಳ್ಳತನ ಗ್ಯಾಂಗ್‌ನ ಪ್ರಮುಖ ಆರೋಪಿ ಬಂಧನ, ಕಾರು ವಶ",
      "category": "crime",
      "deck": "ಕೊಲ್ಲೂರು ಮೂಕಾಂಬಿಕಾ ಕ್ಷೇತ್ರದ ಬಳಿ ರಸ್ತೆ ಬದಿಯ ಹಸುವನ್ನು ಕಾರಿಗೆ ತುರುಕಿ ಕದ್ದೊಯ್ದಿದ್ದ ಗ್ಯಾಂಗ್‌ನ ಪ್ರಮುಖ ಆರೋಪಿಯನ್ನು ಕೊಲ್ಲೂರು ಪೊಲೀಸರು ಬಂಧಿಸಿದ್ದು, ಕೃತ್ಯಕ್ಕೆ ಬಳಸಲಾದ ಕಾರನ್ನು ವಶಪಡಿಸಿಕೊಂಡಿದ್ದಾರೆ.",
      "points": [
        "ರಸ್ತೆ ಬದಿಯ ಹಸುವನ್ನು ಕ್ಷಣಾರ್ಧದಲ್ಲಿ ಕಾರಿಗೆ ತುಂಬಿಸಿಕೊಂಡು ಪರಾರಿಯಾಗುತ್ತಿದ್ದ ಸಿಸಿಟಿವಿ ದೃಶ್ಯ ಸಾಮಾಜಿಕ ಜಾಲತಾಣಗಳಲ್ಲಿ ವ್ಯಾಪಕ ಆಕ್ರೋಶಕ್ಕೆ ಕಾರಣವಾಗಿತ್ತು.",
        "ವಾಹನದ ನೋಂದಣಿ ಸಂಖ್ಯೆಯ ಆಧಾರದ ಮೇಲೆ ಕ್ಷಿಪ್ರ ಕಾರ್ಯಾಚರಣೆ ನಡೆಸಿದ ಕೊಲ್ಲೂರು ಠಾಣಾ ಪೊಲೀಸರು ಆರೋಪಿಯನ್ನು ಹೆಡೆಮುರಿ ಕಟ್ಟಿದ್ದಾರೆ.",
        "ತಲೆಮರೆಸಿಕೊಂಡಿರುವ ಇನ್ನಿಬ್ಬರು ಸಹಚರರಿಗಾಗಿ ಪೊಲೀಸ್ ತಂಡಗಳು ಬಲೆ ಬೀಸಿದ್ದು, ಪ್ರಾಣಿ ಹಿಂಸೆ ತಡೆ ಹಾಗೂ ಕಳ್ಳತನ ಕಾಯ್ದೆಯಡಿ ಕಠಿಣ ಕಾನೂನು ಕ್ರಮ ಕೈಗೊಳ್ಳಲಾಗಿದೆ."
      ],
      "takeaway": "ತಲೆಮರೆಸಿಕೊಂಡಿರುವ ಇತರ ಇಬ್ಬರು ಶಂಕಿತ ಸಹಚರರ ಪತ್ತೆಗೆ ಕೊಲ್ಲೂರು ಪೊಲೀಸರು ತೀವ್ರ ಶೋಧ ನಡೆಸುತ್ತಿದ್ದಾರೆ.",
      "location": "ಕೊಲ್ಲೂರು",
      "sources": [
        "ಉದಯವಾಣಿ"
      ],
      "source_urls": [
        "https://udayavani.com/udupi-news/kollur-main-accused-arrested-for-absconding-after-filling-cattle-in-car-975482?lang=kn"
      ],
      "status": "confirmed",
      "published_at": "2026-10-03T09:15:00+05:30",
      "verified_by": "Gautam Paduvari",
      "verified_at": "2026-10-03T12:57:41+0530"
    },
    {
      "segment": "saara",
      "photo_plan": "",
      "headline": "ಬಂಟ್ವಾಡಿ: ಬೈಕ್‌ಗಳ ಮುಖಾಮುಖಿ ಭೀಕರ ಡಿಕ್ಕಿ, ಇಬ್ಬರು ಸವಾರರಿಗೆ ಗಂಭೀರ ಗಾಯ",
      "category": "accident",
      "deck": "ಗಂಗೊಳ್ಳಿ ಆರಕ್ಷಕ ಠಾಣಾ ವ್ಯಾಪ್ತಿಯ ಬಂಟ್ವಾಡಿಯಿಂದ ಆಲೂರು ಸಂಪರ್ಕಿಸುವ ಮುಖ್ಯ ರಸ್ತೆಯ ಕಡಿದಾದ ತಿರುವಿನಲ್ಲಿ ಎರಡು ದ್ವಿಚಕ್ರ ವಾಹನಗಳು ಮುಖಾಮುಖಿ ಡಿಕ್ಕಿಯಾದ ಪರಿಣಾಮ ಇಬ್ಬರೂ ಬೈಕ್ ಸವಾರರು ಗಂಭೀರವಾಗಿ ಗಾಯಗೊಂಡಿದ್ದಾರೆ.",
      "points": [
        "ಕಡಿದಾದ ತಿರುವಿನಲ್ಲಿ ವಾಹನ ನಿಯಂತ್ರಿಸಲಾಗದೆ ಎರಡೂ ಬೈಕ್‌ಗಳು ರಭಸವಾಗಿ ಅಪ್ಪಳಿಸಿದ ಪರಿಣಾಮ ಸವಾರರು ರಸ್ತೆ ಪಕ್ಕಕ್ಕೆ ಎಸೆಯಲ್ಪಟ್ಟು ವಾಹನಗಳು ಸಂಪೂರ್ಣ ಜಖಂಗೊಂಡಿವೆ.",
        "ರಕ್ತದ ಮಡುವಿನಲ್ಲಿ ಬಿದ್ದಿದ್ದ ಗಾಯಾಳುಗಳನ್ನು ಸ್ಥಳೀಯ ಸಾರ್ವಜನಿಕರು ತಕ್ಷಣವೇ ರಕ್ಷಿಸಿ ಹೆಚ್ಚಿನ ಚಿಕಿತ್ಸೆಗಾಗಿ ಉಡುಪಿಯ ಖಾಸಗಿ ಆಸ್ಪತ್ರೆಗೆ ದಾಖಲಿಸಿದ್ದಾರೆ.",
        "ಸ್ಥಳಕ್ಕೆ ಭೇಟಿ ನೀಡಿದ ಗಂಗೊಳ್ಳಿ ಠಾಣಾ ಪೊಲೀಸರು ಸ್ಥಳ ಮಹಜರು ನಡೆಸಿ ಸಂಚಾರ ತೆರವುಗೊಳಿಸಿದ್ದು, ಅಜಾಗರೂಕ ಚಾಲನೆಯ ವಿರುದ್ಧ ಪ್ರಕರಣ ದಾಖಲಿಸಿಕೊಂಡಿದ್ದಾರೆ."
      ],
      "takeaway": "ಕಡಿದಾದ ರಸ್ತೆ ತಿರುವುಗಳಲ್ಲಿ ವಾಹನಗಳ ವೇಗ ನಿಯಂತ್ರಿಸಿ ಎಚ್ಚರಿಕೆಯಿಂದ ಚಲಾಯಿಸುವಂತೆ ಸಂಚಾರ ಪೊಲೀಸರು ಸೂಚಿಸಿದ್ದಾರೆ.",
      "location": "ಗಂಗೊಳ್ಳಿ",
      "sources": [
        "ಉದಯವಾಣಿ"
      ],
      "source_urls": [
        "https://udayavani.com/udupi-news/two-motorbikes-riders-injured-313702?lang=kn"
      ],
      "status": "confirmed",
      "published_at": "2026-10-03T09:30:00+05:30",
      "verified_by": "Gautam Paduvari",
      "verified_at": "2026-10-03T12:57:41+0530"
    },
    {
      "segment": "saara",
      "photo_plan": "",
      "headline": "ಕುಂದಾಪುರ: ಸಿದ್ದಾಪುರ ಮಾರ್ಗದಲ್ಲಿ ಹೆಚ್ಚುವರಿ ಕೆಎಸ್‌ಆರ್‌ಟಿಸಿ ಬಸ್‌ಗೆ ತೀವ್ರ ಆಗ್ರಹ",
      "category": "civic",
      "deck": "ಕುಂದಾಪುರ ಪಟ್ಟಣದಿಂದ ಸಿದ್ದಾಪುರ ಗ್ರಾಮೀಣ ಭಾಗಕ್ಕೆ ನಿತ್ಯ ಸಂಚರಿಸುವ 600ಕ್ಕೂ ಅಧಿಕ ಶಾಲಾ-ಕಾಲೇಜು ವಿದ್ಯಾರ್ಥಿಗಳು ಹಾಗೂ ನೌಕರರು ಬಸ್‌ಗಳಿಲ್ಲದೆ ಪರದಾಡುತ್ತಿದ್ದು, ಹೆಚ್ಚುವರಿ ಸರಕಾರಿ ಬಸ್ ಓಡಿಸಲು ಆಗ್ರಹ ವ್ಯಕ್ತವಾಗಿದೆ.",
      "points": [
        "ಬೆಳಗಿನ ಹಾಗೂ ಸಂಜೆಯ ಶಾಲಾ ಅವಧಿಯಲ್ಲಿ ಬಸ್ಸುಗಳ ಕೊರತೆಯಿಂದ ವಿದ್ಯಾರ್ಥಿಗಳು ಪಾದಫಲಕದಲ್ಲಿ ಅಪಾಯಕಾರಿಯಾಗಿ ಪ್ರಯಾಣಿಸುವಂತಾಗಿದ್ದು, ಹಿರಿಯರು ಬಸ್ ಹತ್ತಲಾಗದೆ ಪರದಾಡುತ್ತಿದ್ದಾರೆ.",
        "ಬಾಸ್ರೂರು, ಕಂದ್ಲೂರು, ಶಂಕರನಾರಾಯಣ ಮಾರ್ಗದ ಸಿದ್ದಾಪುರ ರಸ್ತೆಯಲ್ಲಿ ಹೆಚ್ಚಿನ ಬಸ್ ನಿಯೋಜಿಸುವಂತೆ ಪಂಚಾಯಿತಿ ಪ್ರತಿನಿಧಿಗಳು ಸಾರಿಗೆ ಇಲಾಖೆಗೆ ಮನವಿ ಸಲ್ಲಿಸಿದ್ದಾರೆ.",
        "ಸಾರಿಗೆ ಪ್ರಾಧಿಕಾರ ತಕ್ಷಣವೇ ಹೆಚ್ಚುವರಿ ಬಸ್ ಸೇವೆ ಆರಂಭಿಸದಿದ್ದರೆ ವಿದ್ಯಾರ್ಥಿಗಳೊಂದಿಗೆ ಬೀದಿಗಿಳಿದು ಪ್ರತಿಭಟನೆ ನಡೆಸುವುದಾಗಿ ಸ್ಥಳೀಯ ಸಂಘಟನೆಗಳು ಎಚ್ಚರಿಕೆ ನೀಡಿವೆ."
      ],
      "takeaway": "ಹೆಚ್ಚುವರಿ ಬಸ್ ನಿಯೋಜಿಸದಿದ್ದರೆ ವಿದ್ಯಾರ್ಥಿಗಳೊಂದಿಗೆ ರಸ್ತೆಗಿಳಿದು ಬೃಹತ್ ಪ್ರತಿಭಟನೆ ನಡೆಸಲು ಸ್ಥಳೀಯರು ನಿರ್ಧರಿಸಿದ್ದಾರೆ.",
      "location": "ಕುಂದಾಪುರ",
      "sources": [
        "ಉದಯವಾಣಿ"
      ],
      "source_urls": [
        "https://udayavani.com/udupi-news/demand-for-additional-government-bus-service-between-kundapura-and-siddapura-369734?lang=kn"
      ],
      "status": "confirmed",
      "published_at": "2026-10-03T09:45:00+05:30",
      "verified_by": "Gautam Paduvari",
      "verified_at": "2026-10-03T12:57:41+0530"
    },
    {
      "segment": "saara",
      "photo_plan": "",
      "headline": "ಕೊಲ್ಲೂರು: ಶಿಥಿಲಗೊಂಡ 'ಸೌಪರ್ಣಿಕಾ' ಸರಕಾರಿ ಅತಿಥಿಗೃಹ ಮರುನಿರ್ಮಾಣಕ್ಕೆ ಭಕ್ತರ ಒತ್ತಾಯ",
      "category": "civic",
      "deck": "ಕೊಲ್ಲೂರು ಮೂಕಾಂಬಿಕಾ ಕ್ಷೇತ್ರಕ್ಕೆ ಬರುವ ಯಾತ್ರಾರ್ಥಿಗಳಿಗಾಗಿ 4 ದಶಕಗಳ ಹಿಂದೆ ನಿರ್ಮಿಸಲಾಗಿದ್ದ 'ಸೌಪರ್ಣಿಕಾ' ಸರಕಾರಿ ಅತಿಥಿಗೃಹ ಶಿಥಿಲಾವಸ್ಥೆ ತಲುಪಿದ್ದು, ನೂತನ ಕಟ್ಟಡ ನಿರ್ಮಾಣಕ್ಕೆ ಕೂಗು ಕೇಳಿಬಂದಿದೆ.",
      "points": [
        "ಮಳೆಗಾಲದಲ್ಲಿ ಕಟ್ಟಡದ ಛಾವಣಿ ಸೋರುತ್ತಿದ್ದು ಗೋಡೆಗಳಲ್ಲಿ ಬಿರುಕು ಕಾಣಿಸಿಕೊಂಡಿರುವುದರಿಂದ ಯಾತ್ರಿಕರಿಗೆ ಕೊಠಡಿ ನೀಡಲಾಗದೆ ಕಟ್ಟಡ ಪಾಳುಬಿದ್ದ ಸ್ಥಿತಿಯಲ್ಲಿದೆ.",
        "ಮುಂಬರುವ ನವರಾತ್ರಿ ಉತ್ಸವಕ್ಕೆ ಲಕ್ಷಾಂತರ ಭಕ್ತರು ಆಗಮಿಸಲಿರುವ ಹಿನ್ನೆಲೆಯಲ್ಲಿ ನೂತನ ಸುಸಜ್ಜಿತ ವಸತಿ ಸಮುಚ್ಛಯ ನಿರ್ಮಿಸುವುದು ಅನಿವಾರ್ಯವಾಗಿದೆ ಎಂದು ಸ್ಥಳೀಯರು ಹೇಳಿದ್ದಾರೆ.",
        "ಲೋಕೋಪಯೋಗಿ ಇಲಾಖೆ ರೂಪಿಸಿರುವ 16 ಕೋಟಿ ರೂಪಾಯಿ ವೆಚ್ಚದ ಮರುನಿರ್ಮಾಣ ಪ್ರಸ್ತಾವನೆಗೆ ರಾಜ್ಯ ಸರಕಾರ ಅನುಮೋದನೆ ಹಾಗೂ ಅನುದಾನ ಬಿಡುಗಡೆ ಮಾಡಬೇಕೆಂದು ಭಕ್ತರು ಒತ್ತಾಯಿಸಿದ್ದಾರೆ."
      ],
      "takeaway": "ನವರಾತ್ರಿ ವೇಳೆಗೆ ಭಕ್ತರಿಗೆ ಸುಸಜ್ಜಿತ ವಸತಿ ಕಲ್ಪಿಸಲು 16 ಕೋಟಿ ರೂಪಾಯಿ ವೆಚ್ಚದ ಪ್ರಸ್ತಾವನೆಗೆ ಸರಕಾರ ಅನುಮೋದನೆ ನೀಡಬೇಕಿದೆ.",
      "location": "ಕೊಲ್ಲೂರು",
      "sources": [
        "ಉದಯವಾಣಿ"
      ],
      "source_urls": [
        "https://udayavani.com/udupi-news/kollur-demand-for-reconstruction-of-government-guest-house-431113?lang=kn"
      ],
      "status": "confirmed",
      "published_at": "2026-10-03T10:00:00+05:30",
      "verified_by": "Gautam Paduvari",
      "verified_at": "2026-10-03T12:57:41+0530"
    },
    {
      "segment": "saara",
      "photo_plan": "",
      "headline": "ಬ್ರಹ್ಮಾವರ: ಬಾರ್ಕೂರು ರಸ್ತೆಯಲ್ಲಿ ನಡೆದು ತೆರಳುತ್ತಿದ್ದ ಬಾಲಕನಿಗೆ ಕಾರು ಢಿಕ್ಕಿ, ಗಾಯ",
      "category": "accident",
      "involves_minor": true,
      "deck": "ಬ್ರಹ್ಮಾವರದ ಬಾರ್ಕೂರು ರಸ್ತೆ ಬದಿಯಲ್ಲಿ ನಡೆದು ತೆರಳುತ್ತಿದ್ದ ಶಾಲಾ ವಿದ್ಯಾರ್ಥಿಗೆ ಹಿಂಬದಿಯಿಂದ ಅತಿವೇಗವಾಗಿ ಬಂದ ಕಾರು ಢಿಕ್ಕಿ ಹೊಡೆದ ಪರಿಣಾಮ ಬಾಲಕ ಗಂಭೀರವಾಗಿ ಗಾಯಗೊಂಡಿದ್ದಾನೆ.",
      "points": [
        "ಅಪಘಾತ ಸಂಭವಿಸಿದ ಕೂಡಲೇ ಸ್ಥಳದಲ್ಲಿದ್ದ ಸಾರ್ವಜನಿಕರು ಧಾವಿಸಿ ಗಾಯಗೊಂಡ ಬಾಲಕನನ್ನು ತಕ್ಷಣವೇ ಬ್ರಹ್ಮಾವರದ ಖಾಸಗಿ ಆಸ್ಪತ್ರೆಗೆ ದಾಖಲಿಸಿ ಚಿಕಿತ್ಸೆ ಕೊಡಿಸಿದ್ದಾರೆ.",
        "ಶಾಲಾ ಅವಧಿಯಲ್ಲಿ ವಾಹನಗಳ ಮಿತಿಮೀರಿದ ವೇಗವೇ ಅವಘಡಕ್ಕೆ ಕಾರಣವಾಗಿದ್ದು, ಶಾಲಾ ವಲಯದಲ್ಲಿ ವೇಗ ನಿಯಂತ್ರಕಗಳನ್ನು ಅಳವಡಿಸಲು ಪೋಷಕರು ಆಕ್ರೋಶ ವ್ಯಕ್ತಪಡಿಸಿದ್ದಾರೆ.",
        "ಘಟನೆಗೆ ಸಂಬಂಧಿಸಿದಂತೆ ಬ್ರಹ್ಮಾವರ ಆರಕ್ಷಕ ಠಾಣೆಯಲ್ಲಿ ಕಾರು ಚಾಲಕನ ವಿರುದ್ಧ ಅಜಾಗರೂಕ ಚಾಲನೆಯ ಪ್ರಕರಣ ದಾಖಲಾಗಿದ್ದು, ಪೊಲೀಸರು ಕಾನೂನು ತನಿಖೆ ಕೈಗೊಂಡಿದ್ದಾರೆ."
      ],
      "takeaway": "ಶಾಲಾ ವಲಯಗಳಲ್ಲಿ ವಾಹನಗಳ ವೇಗ ಮಿತಿಗೆ ಕಟ್ಟುನಿಟ್ಟಿನ ನಿಯಂತ್ರಕಗಳನ್ನು ಅಳವಡಿಸುವಂತೆ ಪೋಷಕರು ಒತ್ತಾಯಿಸಿದ್ದಾರೆ.",
      "location": "ಬ್ರಹ್ಮಾವರ",
      "sources": [
        "ಉದಯವಾಣಿ"
      ],
      "source_urls": [
        "https://udayavani.com/udupi-news/car-hits-school-student-in-brahmavar-252127?lang=kn"
      ],
      "status": "confirmed",
      "published_at": "2026-10-03T10:15:00+05:30",
      "verified_by": "Gautam Paduvari",
      "verified_at": "2026-10-03T12:57:41+0530"
    },
    {
      "segment": "saara",
      "photo_plan": "",
      "headline": "ಕುಂದಾಪುರ-ಬೈಂದೂರು: ಅರಣ್ಯ ಗಡಿ ವ್ಯಾಪ್ತಿಯಲ್ಲಿ ಅಕ್ರಮ ಮಾರ್ಪಾಡಿನ 4 ಬಂದೂಕು ವಶ",
      "category": "crime",
      "deck": "ಕುಂದಾಪುರ ಹಾಗೂ ಬೈಂದೂರು ತಾಲೂಕುಗಳ ಅರಣ್ಯ ಗಡಿ ಭಾಗದಲ್ಲಿ ಪೊಲೀಸರು ನಡೆಸಿದ ಜಂಟಿ ಪರಿಶೀಲನಾ ಕಾರ್ಯಾಚರಣೆಯ ವೇಳೆ, ನಿಯಮಬಾಹಿರವಾಗಿ ಮಾರ್ಪಾಡು ಮಾಡಲಾಗಿದ್ದ 4 ಬಂದೂಕುಗಳು ಪತ್ತೆಯಾಗಿವೆ.",
      "points": [
        "ಪರವಾನಗಿ ಪಡೆದ ಬಂದೂಕುಗಳನ್ನು ಮಾರ್ಪಡಿಸಿ ವನ್ಯಜೀವಿ ಬೇಟೆಗೆ ಬಳಸುತ್ತಿರುವ ಬಗ್ಗೆ ಬಂದ ಖಚಿತ ಮಾಹಿತಿ ಮೇರೆಗೆ ಗ್ರಾಮೀಣ ಭಾಗದ ಮನೆಗಳ ಮೇಲೆ ಪೊಲೀಸರು ತಪಾಸಣೆ ನಡೆಸಿದ್ದರು.",
        "ನಳಿಕೆ ಹಾಗೂ ಗುಂಡಿನ ಸಾಮರ್ಥ್ಯ ಮಾರ್ಪಡಿಸಿಕೊಂಡಿದ್ದ ಬಂದೂಕುಗಳನ್ನು ವಶಪಡಿಸಿಕೊಂಡು, ಪರವಾನಗಿದಾರರ ವಿರುದ್ಧ ಶಸ್ತ್ರಾಸ್ತ್ರ ಕಾಯ್ದೆಯಡಿ ಪ್ರಕರಣ ದಾಖಲಿಸಲಾಗಿದೆ.",
        "ಅರಣ್ಯಂಚಿನ ಹಳ್ಳಿಗಳಲ್ಲಿ ಅನಧಿಕೃತ ಶಸ್ತ್ರಾಸ್ತ್ರಗಳ ಮೇಲೆ ನಿಗಾ ಇರಿಸಲಾಗಿದ್ದು, ನಿಯಮ ಉಲ್ಲಂಘಿಸುವವರ ವಿರುದ್ಧ ಕಠಿಣ ಕ್ರಮ ಕೈಗೊಳ್ಳುವುದಾಗಿ ಪೊಲೀಸರು ಎಚ್ಚರಿಸಿದ್ದಾರೆ."
      ],
      "takeaway": "ಪರವಾನಗಿ ಷರತ್ತು ಉಲ್ಲಂಘಿಸಿ ಬಂದೂಕು ಮಾರ್ಪಡಿಸಿಕೊಂಡರೆ ಕಠಿಣ ಕಾನೂನು ಕ್ರಮ ಕೈಗೊಳ್ಳುವುದಾಗಿ ಜಿಲ್ಲಾ ಪೊಲೀಸ್ ಎಚ್ಚರಿಸಿದೆ.",
      "location": "ಕುಂದಾಪುರ",
      "sources": [
        "ಉದಯವಾಣಿ"
      ],
      "source_urls": [
        "https://udayavani.com/udupi-news/udupi-special-inspection-of-weapons-4-modified-guns-found-935523?lang=kn"
      ],
      "status": "confirmed",
      "published_at": "2026-10-03T10:30:00+05:30",
      "verified_by": "Gautam Paduvari",
      "verified_at": "2026-10-03T12:57:41+0530"
    }
  ]
}
