{
  "date": "2026-09-25T13:00:00+05:30",
  "edition_no": 1,
  "strapline": "ಕಾನೂನು ಕವಚ • ವಿಶೇಷ ಜಾಗೃತಿ",
  "stories": [
    {
      "headline": "ಖಾಸಗಿ ಫೋಟೋ-ವಿಡಿಯೋ ಬ್ಲ್ಯಾಕ್‌ಮೇಲ್‌ಗೆ ಹೆದರಬೇಡಿ: ಕಾನೂನು ನಿಮ್ಮ ಪರ!",
      "category": "explainer",
      "deck": "ಸಂಬಂಧಗಳಲ್ಲಿ ಅಥವಾ ಬ್ರೇಕಪ್ ನಂತರ ಖಾಸಗಿ ಫೋಟೋ, ವಿಡಿಯೋ ಲೀಕ್ ಮಾಡುವುದಾಗಿ ಬೆದರಿಸುವುದು ಗಂಭೀರ ಅಪರಾಧ. ಸಂತ್ರಸ್ತ ಯುವತಿಯರಿಗೆ ಭಾರತೀಯ ಕಾನೂನು ನೀಡುವ ಬಲಿಷ್ಠ ಅಸ್ತ್ರಗಳ ಸಂಪೂರ್ಣ ಮಾಹಿತಿ ಇಲ್ಲಿದೆ.",
      "points": [
        "ಪ್ರೀತಿಯ ಹೆಸರಿನಲ್ಲಿ ನಂಬಿಸಿ ನಂತರ ಖಾಸಗಿ ದೃಶ್ಯಗಳನ್ನು ದುರ್ಬಳಕೆ ಮಾಡುವುದು ಕಾನೂನಿನಡಿ ಕಠಿಣ ಶಿಕ್ಷಾರ್ಹ ಕೃತ್ಯ.",
        "ಸಂತ್ರಸ್ತೆ ಯಾವುದೇ ತಪ್ಪು ಮಾಡಿಲ್ಲ; ಬ್ಲ್ಯಾಕ್‌ಮೇಲ್ ಮಾಡುವ ವ್ಯಕ್ತಿಯೇ ನೂರಕ್ಕೆ ನೂರು ಅಪರಾಧಿ.",
        "ಕಾನೂನು ಸಂತ್ರಸ್ತೆಯ ಗುರುತನ್ನು ಗೌಪ್ಯವಾಗಿಟ್ಟು ಸಂಪೂರ್ಣ ರಕ್ಷಣೆ ಮತ್ತು ಉಚಿತ ಕಾನೂನು ನೆರವು ನೀಡುತ್ತದೆ."
      ],
      "takeaway": "ತುರ್ತು ಸಹಾಯಕ್ಕಾಗಿ 1930 ಸೈಬರ್ ಕ್ರೈಂ ಅಥವಾ 112 ಸಹಾಯವಾಣಿಗೆ ಕರೆ ಮಾಡಿ.",
      "location": "ಕರಾವಳಿ",
      "sources": [
        "ಊರ್ಮನಿ ಸುದ್ದಿ ಸ್ಥಳ ವರದಿ"
      ],
      "source_urls": [],
      "status": "official",
      "verified_by": "Gautam",
      "verified_at": "2026-09-25T13:00:00+05:30",
      "published_at": "2026-09-25T13:00:00+05:30",
      "is_reel": false,
      "photo": {
        "path": "assets/kanoonu_kavacha/kanoonu_cover_empowerment.jpg",
        "nature": "ai",
        "credit": "ಊರ್ಮನಿ ಸುದ್ದಿ",
        "licence": "own",
        "caption": "ಅಧ್ಯಯನ ನಿರತ ಯುವತಿ"
      }
    },
    {
      "headline": "ಪ್ರೀತಿಯ ಹೆಸರಿನ ಬ್ಲ್ಯಾಕ್‌ಮೇಲ್: ಇವು ಸಾಮಾನ್ಯ ಕಲಹವಲ್ಲ, ಕ್ರಿಮಿನಲ್ ಕೃತ್ಯ",
      "category": "explainer",
      "deck": "ಸಂಬಂಧದಲ್ಲಿದ್ದಾಗ ನಂಬಿಕೆಯಿಂದ ಕಳುಹಿಸಿದ ಖಾಸಗಿ ಫೋಟೋಗಳನ್ನು ಮುಂದಿಟ್ಟುಕೊಂಡು ಹಣ ಅಥವಾ ಮಾತು ಕೇಳುವಂತೆ ಬ್ಲ್ಯಾಕ್‌ಮೇಲ್ ಮಾಡುವುದು 'ಸೆಕ್ಸ್ಟೋರ್ಷನ್'. ಇದು ಕೇವಲ ಪ್ರೇಮ ವೈಫಲ್ಯವಲ್ಲ, ಶಿಕ್ಷಾರ್ಹ ಅಪರಾಧ.",
      "points": [
        "ಬ್ಲ್ಯಾಕ್‌ಮೇಲರ್‌ನ ಯಾವುದೇ ಬೆದರಿಕೆಗೂ ಅಥವಾ ಬೇಡಿಕೆಗೂ ಎಂದಿಗೂ ಮಣಿಯಬೇಡಿ; ಒಮ್ಮೆ ಒಪ್ಪಿದರೆ ಕಿರುಕುಳ ನಿಲ್ಲುವುದಿಲ್ಲ.",
        "ಆತಂಕದಲ್ಲಿ ಚಾಟ್‌ಗಳು, ಆಡಿಯೋ ಅಥವಾ ಕಾಲ್ ರೆಕಾರ್ಡ್‌ಗಳನ್ನು ಡಿಲೀಟ್ ಮಾಡದೆ ಸಾಕ್ಷ್ಯವಾಗಿ ಸುರಕ್ಷಿತವಾಗಿಡಿ.",
        "ನೆನಪಿಡಿ: ತಪ್ಪು ಮಾಡಿದ್ದು ಬ್ಲ್ಯಾಕ್‌ಮೇಲ್ ಮಾಡುವ ವ್ಯಕ್ತಿಯೇ ಹೊರತು ನೀವಲ್ಲ; ಧೈರ್ಯವಾಗಿ ನಿಲ್ಲಿ."
      ],
      "takeaway": "ಬೆದರಿಕೆಯ ಯಾವುದೇ ಸಾಕ್ಷ್ಯವನ್ನು ಡಿಲೀಟ್ ಮಾಡಬೇಡಿ; ಸ್ಕ್ರೀನ್‌ಶಾಟ್ ತೆಗೆದಿಟ್ಟುಕೊಳ್ಳಿ.",
      "location": "ಕರಾವಳಿ",
      "sources": [
        "ಊರ್ಮನಿ ಸುದ್ದಿ ಸ್ಥಳ ವರದಿ"
      ],
      "source_urls": [],
      "status": "official",
      "verified_by": "Gautam",
      "verified_at": "2026-09-25T13:00:00+05:30",
      "published_at": "2026-09-25T13:00:00+05:30",
      "is_reel": false,
      "photo": {
        "path": "assets/kanoonu_kavacha/kanoonu_supportive_friends.jpg",
        "nature": "ai",
        "credit": "ಊರ್ಮನಿ ಸುದ್ದಿ",
        "licence": "own",
        "caption": "ಸ್ನೇಹಿತೆಯೊಂದಿಗೆ ಸಮಾಲೋಚಿಸುತ್ತಿರುವ ವಿದ್ಯಾರ್ಥಿನಿಯರು"
      }
    },
    {
      "headline": "ಐಟಿ ಕಾಯ್ದೆ ಸೆಕ್ಷನ್ 66E, 67, 67A: 3 ರಿಂದ 5 ವರ್ಷ ಜೈಲು ಶಿಕ್ಷೆ!",
      "category": "explainer",
      "deck": "ವ್ಯಕ್ತಿಯ ಅನುಮತಿಯಿಲ್ಲದೆ ಖಾಸಗಿ ಅಂಗಾಂಗಗಳ ಚಿತ್ರ ಸೆರೆಹಿಡಿಯುವುದು ಅಥವಾ ಹಂಚುವುದು ಜಾಮೀನು ರಹಿತ ಗಂಭೀರ ಅಪರಾಧವಾಗಿದೆ. ಕಾನೂನು ಸಂತ್ರಸ್ತೆಯ ಗೌಪ್ಯತೆಯನ್ನು ಕಡ್ಡಾಯವಾಗಿ ರಕ್ಷಿಸುತ್ತದೆ.",
      "points": [
        "ಸೆಕ್ಷನ್ 66E: ವ್ಯಕ್ತಿಯ ಅನುಮತಿಯಿಲ್ಲದೆ ಖಾಸಗಿ ಚಿತ್ರ ತೆಗೆಯುವುದು ಅಥವಾ ಹಂಚುವುದು ನೇರ ಖಾಸಗಿತನ ಉಲ್ಲಂಘನೆ.",
        "ಸೆಕ್ಷನ್ 67 & 67A: ಅಶ್ಲೀಲ ಅಥವಾ ಲೈಂಗಿಕ ದೃಶ್ಯಗಳನ್ನು ಪ್ರಸಾರ ಮಾಡಿದರೆ 5 ವರ್ಷ ಜೈಲು ಮತ್ತು 10 ಲಕ್ಷ ರೂ. ದಂಡ.",
        "ವಾಟ್ಸಾಪ್ ಗ್ರೂಪ್, ಟೆಲಿಗ್ರಾಂ ಅಥವಾ ಸೋಷಿಯಲ್ ಮೀಡಿಯಾದಲ್ಲಿ ಹಂಚಿದರೂ ಇದೇ ಕಠಿಣ ಕಾಯ್ದೆ ಅನ್ವಯಿಸುತ್ತದೆ."
      ],
      "takeaway": "ಡಿಜಿಟಲ್ ಲೀಕ್ ಬೆದರಿಕೆಗೆ 5 ವರ್ಷಗಳವರೆಗೆ ಕಠಿಣ ಜೈಲು ಶಿಕ್ಷೆಯಿದೆ.",
      "location": "ಕರಾವಳಿ",
      "sources": [
        "ಊರ್ಮನಿ ಸುದ್ದಿ ಸ್ಥಳ ವರದಿ"
      ],
      "source_urls": [],
      "status": "official",
      "verified_by": "Gautam",
      "verified_at": "2026-09-25T13:00:00+05:30",
      "published_at": "2026-09-25T13:00:00+05:30",
      "is_reel": false,
      "photo": {
        "path": "assets/stock/coastal_court_complex_judiciary.jpg",
        "nature": "ai",
        "credit": "ಊರ್ಮನಿ ಸುದ್ದಿ",
        "licence": "own",
        "caption": "ಜಿಲ್ಲಾ ನ್ಯಾಯಾಲಯ ಸಂಕೀರ್ಣದ ಆವರಣ"
      }
    },
    {
      "headline": "ಭಾರತೀಯ ನ್ಯಾಯ ಸಂಹಿತೆ (BNS): ಸುಲಿಗೆ & ಕ್ರಿಮಿನಲ್ ಬೆದರಿಕೆಗೆ ಕಠಿಣ ಶಿಕ್ಷೆ",
      "category": "explainer",
      "deck": "\"ಫೋಟೋ ಲೀಕ್ ಮಾಡುತ್ತೇನೆ\", \"ಮನೆಯವರಿಗೆ ಕಳುಹಿಸುತ್ತೇನೆ\" ಎಂದು ಹೆದರಿಸಿ ಹಣ ಕೀಳುವುದು ಅಥವಾ ಮಾತು ಕೇಳುವಂತೆ ಒತ್ತಾಯಿಸುವುದು ಭಾರತೀಯ ನ್ಯಾಯ ಸಂಹಿತೆಯಡಿ ಜಾಮೀನು ರಹಿತ ಕ್ರಿಮಿನಲ್ ಮೊಕದ್ದಮೆಯಾಗಿದೆ.",
      "points": [
        "BNS ಸೆಕ್ಷನ್ 308: ಬ್ಲ್ಯಾಕ್‌ಮೇಲ್ ಮೂಲಕ ಹಣ ಅಥವಾ ಬೇಡಿಕೆ ಈಡೇರಿಸಿಕೊಳ್ಳುವುದು ಗಂಭೀರ ಸುಲಿಗೆ (Extortion) ಅಪರಾಧ.",
        "BNS ಸೆಕ್ಷನ್ 351: ಮಾನಹಾನಿ ಮಾಡುತ್ತೇನೆ ಅಥವಾ ಸಾಯುತ್ತೇನೆ ಎಂದು ಹೆದರಿಸುವುದು ಕ್ರಿಮಿನಲ್ ಬೆದರಿಕೆ ಕೃತ್ಯ.",
        "ಸಂತ್ರಸ್ತೆಯ ಗುರುತನ್ನು ಪೊಲೀಸರಾಗಲಿ, ಮಾಧ್ಯಮಗಳಾಗಲಿ ಬಹಿರಂಗಪಡಿಸುವಂತಿಲ್ಲ (ಕಾನೂನಿನ ಕಡ್ಡಾಯ ರಕ್ಷಣೆ)."
      ],
      "takeaway": "ಬ್ಲ್ಯಾಕ್‌ಮೇಲ್ ಮಾಡುವವರು ಕಾನೂನಿನಡಿ ಜಾಮೀನು ರಹಿತ ಬಂಧನ ಎದುರಿಸುತ್ತಾರೆ.",
      "location": "ಕರಾವಳಿ",
      "sources": [
        "ಊರ್ಮನಿ ಸುದ್ದಿ ಸ್ಥಳ ವರದಿ"
      ],
      "source_urls": [],
      "status": "official",
      "verified_by": "Gautam",
      "verified_at": "2026-09-25T13:00:00+05:30",
      "published_at": "2026-09-25T13:00:00+05:30",
      "is_reel": false,
      "photo": {
        "path": "assets/stock/police_cctv_surveillance_monitoring.jpg",
        "nature": "ai",
        "credit": "ಊರ್ಮನಿ ಸುದ್ದಿ",
        "licence": "own",
        "caption": "ಕಣ್ಗಾವಲು ಕ್ಯಾಮೆರಾ ದೃಶ್ಯಾವಳಿಗಳನ್ನು ಪರಿಶೀಲಿಸುತ್ತಿರುವ ತನಿಖಾ ತಂಡ"
      }
    },
    {
      "headline": "StopNCII.org: ಫೋಟೋ ಇಂಟರ್ನೆಟ್‌ಗೆ ಅಪ್‌ಲೋಡ್ ಆಗದಂತೆ ತಡೆಯುವ ಉಚಿತ ತಂತ್ರಜ್ಞಾನ",
      "category": "explainer",
      "deck": "ಖಾಸಗಿ ಫೋಟೋ ಅಥವಾ ವಿಡಿಯೋ ಲೀಕ್ ಆಗುವ ಭಯವಿದ್ದರೆ, ಆ ಚಿತ್ರವನ್ನು ಯಾರಿಗೂ ಕಳುಹಿಸದೆಯೇ ನಿಮ್ಮ ಫೋನ್‌ನಲ್ಲೇ 'ಡಿಜಿಟಲ್ ಹ್ಯಾಶ್' ರಚಿಸಿ ಇನ್‌ಸ್ಟಾಗ್ರಾಮ್‌ಗಳಲ್ಲಿ ಬ್ಲಾಕ್ ಮಾಡುವ ಜಾಗತಿಕ ವೇದಿಕೆ ಇದು.",
      "points": [
        "ನಿಮ್ಮ ಮೂಲ ಫೋಟೋ/ವಿಡಿಯೋ ಅಪ್‌ಲೋಡ್ ಆಗುವುದಿಲ್ಲ; ಕೇವಲ ಡಿಜಿಟಲ್ ಫಿಂಗರ್‌ಪ್ರಿಂಟ್ (Hash) ಮಾತ್ರ ದಾಖಲಾಗುತ್ತದೆ.",
        "ಬ್ಲ್ಯಾಕ್‌ಮೇಲರ್ ಇನ್‌ಸ್ಟಾಗ್ರಾಮ್ ಅಥವಾ ಫೇಸ್‌ಬುಕ್‌ನಲ್ಲಿ ಪೋಸ್ಟ್ ಮಾಡಲು ಯತ್ನಿಸಿದ ತಕ್ಷಣ ಆಟೋಮ್ಯಾಟಿಕ್ ಬ್ಲಾಕ್ ಆಗುತ್ತದೆ.",
        "18 ವರ್ಷ ಮೇಲ್ಪಟ್ಟ ಯುವತಿಯರು StopNCII.org ಬಳಸಬಹುದು; ಇದು ಸಂಪೂರ್ಣ ಉಚಿತ ಮತ್ತು ಗೌಪ್ಯ ತಂತ್ರಜ್ಞಾನ."
      ],
      "takeaway": "ಫೋಟೋ ಲೀಕ್ ಆಗುವ ಮೊದಲೇ StopNCII.org ಮೂಲಕ ಡಿಜಿಟಲ್ ರಕ್ಷಣೆ ಪಡೆದುಕೊಳ್ಳಿ.",
      "location": "ಕರಾವಳಿ",
      "sources": [
        "ಊರ್ಮನಿ ಸುದ್ದಿ ಸ್ಥಳ ವರದಿ"
      ],
      "source_urls": [],
      "status": "official",
      "verified_by": "Gautam",
      "verified_at": "2026-09-25T13:00:00+05:30",
      "published_at": "2026-09-25T13:00:00+05:30",
      "is_reel": false,
      "photo": {
        "path": "assets/kanoonu_kavacha/kanoonu_digital_privacy_defense.jpg",
        "nature": "ai",
        "credit": "ಊರ್ಮನಿ ಸುದ್ದಿ",
        "licence": "own",
        "caption": "ಡಿಜಿಟಲ್ ಸುರಕ್ಷತೆ ಮತ್ತು ಕಾನೂನು ಗ್ರಂಥಗಳು"
      }
    },
    {
      "headline": "ಭಯ ಬೇಡ, ಕರೆ ಮಾಡಿ: 1930 & 112 ಸಹಾಯವಾಣಿ ನಿಮ್ಮ ರಕ್ಷಣೆಗೆ ಸದಾ ಸಿದ್ಧ",
      "category": "explainer",
      "deck": "ಬ್ಲ್ಯಾಕ್‌ಮೇಲ್ ಎದುರಾದಾಗ ಆತಂಕದಲ್ಲಿ ಒಂಟಿಯಾಗಿ ಕೊರಗಬೇಡಿ. ರಾಷ್ಟ್ರೀಯ ಸೈಬರ್ ಕ್ರೈಂ ಪೋರ್ಟಲ್ ಹಾಗೂ ಮಹಿಳಾ ಸಹಾಯವಾಣಿಗಳು ಗೌಪ್ಯವಾಗಿ ನಿಮ್ಮ ರಕ್ಷಣೆಗೆ ಧಾವಿಸುತ್ತವೆ.",
      "points": [
        "1930: ರಾಷ್ಟ್ರೀಯ ಸೈಬರ್ ಅಪರಾಧ ಸಹಾಯವಾಣಿ (National Cyber Crime Helpline).",
        "112 & 1091: ತುರ್ತು ಪೊಲೀಸ್ ನೆರವು ಮತ್ತು ಮಹಿಳಾ ರಕ್ಷಣಾ ಸಹಾಯವಾಣಿ ಸಂಖ್ಯೆಗಳು.",
        "cybercrime.gov.in: ಪೊಲೀಸ್ ಠಾಣೆಗೆ ಹೋಗದೆಯೇ ಮನೆಯಿಂದಲೇ ಆನ್‌ಲೈನ್‌ನಲ್ಲಿ ಗೌಪ್ಯವಾಗಿ ದೂರು ದಾಖಲಿಸುವ ಅಧಿಕೃತ ಪೋರ್ಟಲ್."
      ],
      "takeaway": "ಯಾವುದೇ ಸೈಬರ್ ಕಿರುಕುಳಕ್ಕೆ ತಕ್ಷಣ 1930 ಗೆ ಕರೆ ಮಾಡಿ ದೂರು ದಾಖಲಿಸಿ.",
      "location": "ಕರಾವಳಿ",
      "sources": [
        "ಊರ್ಮನಿ ಸುದ್ದಿ ಸ್ಥಳ ವರದಿ"
      ],
      "source_urls": [],
      "status": "official",
      "verified_by": "Gautam",
      "verified_at": "2026-09-25T13:00:00+05:30",
      "published_at": "2026-09-25T13:00:00+05:30",
      "is_reel": false,
      "photo": {
        "path": "assets/kanoonu_kavacha/kanoonu_helpline_counselor.jpg",
        "nature": "ai",
        "credit": "ಊರ್ಮನಿ ಸುದ್ದಿ",
        "licence": "own",
        "caption": "ಸಹಾಯವಾಣಿ ಕೇಂದ್ರದಲ್ಲಿ ಕಾರ್ಯನಿರ್ವಹಿಸುತ್ತಿರುವ ಸಿಬ್ಬಂದಿ"
      }
    }
  ]
}
