{
  "schema_version": 4,
  "date": "2026-10-02T09:00:00+05:30",
  "edition_no": 1,
  "strapline": "ಕರಾವಳಿ ದಿನಪತ್ರಿಕೆ",
  "stories": [
    {
      "segment": "saara",
      "photo_plan": "",
      "headline": "ನಾವುಂದ: ಕಾರು-ಗೂಡ್ಸ್ ವಾಹನ ಮುಖಾಮುಖಿ ಡಿಕ್ಕಿ, ನಾಲ್ವರಿಗೆ ಗಾಯ",
      "category": "accident",
      "deck": "ರಾಷ್ಟ್ರೀಯ ಹೆದ್ದಾರಿ 66ರ ನಾವುಂದ ಹಾಗೂ ಮರವಂತೆ ನಡುವಿನ ಯು-ಟರ್ನ್ ತಿರುವಿನಲ್ಲಿ ಚಾಲಕರ ನಿಯಂತ್ರಣ ತಪ್ಪಿ ಎರಡೂ ವಾಹನಗಳು ಮುಖಾಮುಖಿ ಡಿಕ್ಕಿಯಾದ ಪರಿಣಾಮ ಉಳ್ಳೂರಿನ ವಿನೀತಾ ಸೇರಿದಂತೆ ನಾಲ್ವರು ಪ್ರಯಾಣಿಕರು ಗಾಯಗೊಂಡಿದ್ದಾರೆ.",
      "points": [
        "ಹೆದ್ದಾರಿಯ ತಿರುವಿನಲ್ಲಿ ವಾಹನಗಳು ರಭಸವಾಗಿ ಅಪ್ಪಳಿಸಿದ ತಕ್ಷಣ ಸ್ಥಳೀಯರ ನೆರವಿನಿಂದ ಗಾಯಾಳುಗಳನ್ನು ಸಮೀಪದ ಸಾರ್ವಜನಿಕ ಆಸ್ಪತ್ರೆಗೆ ದಾಖಲಿಸಲಾಗಿದೆ.",
        "ಅಪಘಾತದ ತೀವ್ರತೆಗೆ ಎರಡೂ ವಾಹನಗಳ ಮುಂಭಾಗ ಜಖಂಗೊಂಡಿದ್ದು, ಹೆದ್ದಾರಿಯಲ್ಲಿ ಕೆಲಕಾಲ ವಾಹನ ಸಂಚಾರ ಅಸ್ತವ್ಯಸ್ತಗೊಂಡಿತ್ತು.",
        "ಸ್ಥಳಕ್ಕೆ ಧಾವಿಸಿದ ಗಂಗೊಳ್ಳಿ ಪೊಲೀಸರು ವಾಹನಗಳನ್ನು ರಸ್ತೆಯಿಂದ ತೆರವುಗೊಳಿಸಿ ಸುಗಮ ಸಂಚಾರಕ್ಕೆ ವ್ಯವಸ್ಥೆ ಮಾಡಿದ್ದು, ಅಜಾಗರೂಕ ಚಾಲನೆ ವಿರುದ್ಧ ಪ್ರಕರಣ ದಾಖಲಿಸಿದ್ದಾರೆ."
      ],
      "takeaway": "ಹೆದ್ದಾರಿಯ ಯು-ಟರ್ನ್ ತಿರುವುಗಳಲ್ಲಿ ವಾಹನಗಳ ವೇಗ ನಿಯಂತ್ರಿಸಿ ಜಾಗರೂಕತೆಯಿಂದ ಚಲಾಯಿಸುವಂತೆ ಸಂಚಾರ ಪೊಲೀಸರು ಸೂಚಿಸಿದ್ದಾರೆ.",
      "location": "ಬೈಂದೂರು",
      "sources": [
        "ಉದಯವಾಣಿ"
      ],
      "source_urls": [
        "https://udayavani.com/udupi-news/Four-injured-in-between-car-and-goods-vehicle-near-Maravanthe-945573?lang=kn"
      ],
      "status": "confirmed",
      "published_at": "2026-10-02T09:15:00+05:30",
      "verified_by": "Gautam Paduvari",
      "verified_at": "2026-10-02T11:36:52+0530"
    },
    {
      "segment": "saara",
      "photo_plan": "",
      "headline": "ಕಾವ್ರಾಡಿ: ಕಾಲೇಜು ವಿದ್ಯಾರ್ಥಿ ಅನ್ವಿತ್ ನಾಪತ್ತೆ, ಪತ್ತೆಗೆ ಪೊಲೀಸರ ಶೋಧ",
      "category": "civic",
      "deck": "ಕುಂದಾಪುರ ತಾಲೂಕಿನ ಕಾವ್ರಾಡಿ ಗ್ರಾಮದ ನಿವಾಸಿ ಉದಯ ಶೇಟ್ ಎಂಬವರ 20 ವರ್ಷದ ಪುತ್ರ, ಕಾಲೇಜು ವಿದ್ಯಾರ್ಥಿ ಅನ್ವಿತ್ ಸಮವಸ್ತ್ರ ಧರಿಸಿ ತೆರಳಿದ ಬಳಿಕ ಮನೆಗೆ ಮರಳದೆ ನಿಗೂಢವಾಗಿ ನಾಪತ್ತೆಯಾಗಿದ್ದಾರೆ.",
      "points": [
        "ಬೆಳಗಿನ ಜಾವ ಕಾಲೇಜಿಗೆ ತೆರಳಿದ ಯುವಕ ಸಂಜೆಯಾದರೂ ಮನೆಗೆ ಮರಳದೆ ಮೊಬೈಲ್ ಸಂಪರ್ಕಕ್ಕೂ ಸಿಗದಿರುವುದರಿಂದ ಕುಟುಂಬಸ್ಥರು ಗ್ರಾಮಾಂತರ ಠಾಣೆಗೆ ದೂರು ನೀಡಿದ್ದಾರೆ.",
        "ವಿದ್ಯಾರ್ಥಿಯ ಮೊಬೈಲ್ ಕರೆಗಳ ವಿವರ ಹಾಗೂ ಕೊನೆಯದಾಗಿ ದಾಖಲಾದ ಲೊಕೇಶನ್ ಮಾಹಿತಿಯನ್ನು ಆಧರಿಸಿ ಪೊಲೀಸರು ತೀವ್ರ ಶೋಧ ಕಾರ್ಯ ಆರಂಭಿಸಿದ್ದಾರೆ.",
        "ವಿದ್ಯಾರ್ಥಿಯ ಚಹರೆ ಹಾಗೂ ಭಾವಚಿತ್ರವನ್ನು ಸುತ್ತಮುತ್ತಲಿನ ಆರಕ್ಷಕ ಠಾಣೆಗಳಿಗೆ ರವಾನಿಸಲಾಗಿದ್ದು, ಮಾಹಿತಿ ಲಭಿಸಿದರೆ ಠಾಣೆಗೆ ತಿಳಿಸಲು ಕೋರಲಾಗಿದೆ."
      ],
      "takeaway": "ನಾಪತ್ತೆಯಾದ ವಿದ್ಯಾರ್ಥಿಯ ಬಗ್ಗೆ ಮಾಹಿತಿ ಲಭಿಸಿದರೆ ತಕ್ಷಣವೇ ಕುಂದಾಪುರ ಗ್ರಾಮಾಂತರ ಆರಕ್ಷಕ ಠಾಣೆಯನ್ನು ಸಂಪರ್ಕಿಸಿ.",
      "location": "ಕುಂದಾಪುರ",
      "sources": [
        "ಉದಯವಾಣಿ"
      ],
      "source_urls": [
        "https://udayavani.com/udupi-news/kavradi-college-student-missing-201635?lang=kn"
      ],
      "status": "confirmed",
      "published_at": "2026-10-02T09:30:00+05:30",
      "verified_by": "Gautam Paduvari",
      "verified_at": "2026-10-02T11:36:52+0530"
    },
    {
      "segment": "saara",
      "photo_plan": "",
      "headline": "ಕರಾವಳಿ: ಬೆಂಗಳೂರು-ಮಡಗಾಂವ್ ವಿಶೇಷ ಎಕ್ಸ್ಪ್ರೆಸ್ ರೈಲು ಸಂಚಾರ ಆರಂಭ",
      "category": "civic",
      "follows_up": "2026-09-29",
      "deck": "ಗಾಂಧಿ ಜಯಂತಿ ಹಾಗೂ ವಾರಾಂತ್ಯದ ರಜೆಯ ಪ್ರಯಾಣಿಕರ ದಟ್ಟಣೆ ನಿರ್ವಹಿಸಲು ನೈರುತ್ಯ ರೈಲ್ವೆಯು ಬೆಂಗಳೂರು ಮತ್ತು ಮಡಗಾಂವ್ ನಡುವೆ ಆರಂಭಿಸಿರುವ 23 ಬೋಗಿಗಳ ವಿಶೇಷ ರೈಲು ಕರಾವಳಿ ಮಾರ್ಗದಲ್ಲಿ ಸಂಚಾರ ಆರಂಭಿಸಿದೆ.",
      "points": [
        "ಬೆಂಗಳೂರು ಕಂಟೋನ್ಮೆಂಟ್ನಿಂದ ಹೊರಟಿರುವ ರೈಲು ಸಂಖ್ಯೆ 06597 ವಿಶೇಷ ರೈಲು ಕೊಂಕಣ ರೈಲ್ವೆಯ ಬಾರ್ಕೂರು, ಕುಂದಾಪುರ ಮತ್ತು ಬೈಂದೂರು ನಿಲ್ದಾಣಗಳಲ್ಲಿ ನಿಲುಗಡೆ ಹೊಂದಿದೆ.",
        "ಹಬ್ಬದ ರಜೆಗೆ ಊರಿಗೆ ಬರುವ ಉದ್ಯೋಗಿಗಳು ಹಾಗೂ ವಿದ್ಯಾರ್ಥಿಗಳಿಗೆ ಕರಾವಳಿಯ ಪ್ರಮುಖ ನಿಲ್ದಾಣಗಳಲ್ಲಿ ಕಲ್ಪಿಸಲಾದ ಈ ರೈಲು ಸೇವೆ ಸಂಚಾರಕ್ಕೆ ದೊಡ್ಡ ನೆರವಾಗಿದೆ.",
        "ಒಟ್ಟು 23 ಬೋಗಿಗಳನ್ನು ಹೊಂದಿರುವ ಈ ವಿಶೇಷ ರೈಲು ಅಕ್ಟೋಬರ್ 4 ರಂದು ಮಡಗಾಂವ್ನಿಂದ ಬೆಂಗಳೂರಿಗೆ ಮರುಪ್ರಯಾಣ ಬೆಳೆಸಲಿದೆ ಎಂದು ಅಧಿಕಾರಿಗಳು ತಿಳಿಸಿದ್ದಾರೆ."
      ],
      "takeaway": "ಬೆಂಗಳೂರು-ಮಡಗಾಂವ್ ವಿಶೇಷ ರೈಲು ಸಂಖ್ಯೆ 06597 ಪ್ರಯಾಣಿಕರ ಸೇವೆಗೆ ಬಾರ್ಕೂರು, ಕುಂದಾಪುರ, ಬೈಂದೂರು ನಿಲ್ದಾಣಗಳಲ್ಲಿ ಲಭ್ಯವಿದೆ.",
      "location": "ಕರಾವಳಿ",
      "sources": [
        "ವಿಜಯ ಕರ್ನಾಟಕ"
      ],
      "source_urls": [
        "https://vijaykarnataka.com/news/karnataka/3-day-long-weekend-special-train-service-launched-between-bengaluru-udupi-madgaon-benefits-6-districts-schedule-released/articleshow/134544030.cms"
      ],
      "status": "official",
      "published_at": "2026-10-02T09:45:00+05:30",
      "verified_by": "Gautam Paduvari",
      "verified_at": "2026-10-02T11:36:52+0530"
    },
    {
      "segment": "saara",
      "photo_plan": "",
      "headline": "ಕೋಟ: ಹೊಂಡ ತಪ್ಪಿಸಲು ಹೋಗಿ ದ್ವಿಚಕ್ರ ವಾಹನದಿಂದ ಬಿದ್ದ ಮಹಿಳೆಗೆ ಗಂಭೀರ ಗಾಯ",
      "category": "accident",
      "deck": "ಕೋಟ ಆರಕ್ಷಕ ಠಾಣಾ ವ್ಯಾಪ್ತಿಯ ಸೈಬ್ರಕಟ್ಟೆಯಿಂದ ಶಿರಿಯಾರ ಸಂಪರ್ಕಿಸುವ ಗ್ರಾಮೀಣ ರಸ್ತೆಯಲ್ಲಿ ಹೊಂಡ ತಪ್ಪಿಸಲು ಸವಾರ ಬ್ರೇಕ್ ಹಾಕಿದಾಗ ದ್ವಿಚಕ್ರ ವಾಹನದಿಂದ ರಸ್ತೆಗೆ ಬಿದ್ದು ಹಿಂಬದಿ ಸವಾರ ಮಹಿಳೆ ಗಂಭೀರ ಗಾಯಗೊಂಡಿದ್ದಾರೆ.",
      "points": [
        "ದ್ವಿಚಕ್ರ ವಾಹನದಿಂದ ರಸ್ತೆಗೆ ಉರುಳಿಬಿದ್ದ ಪರಿಣಾಮ ಮಹಿಳೆಯ ತಲೆ ಹಾಗೂ ಕೈಕಾಲುಗಳಿಗೆ ಬಲವಾದ ಪೆಟ್ಟು ಬಿದ್ದಿದ್ದು, ತಕ್ಷಣ ಸಮೀಪದ ಆಸ್ಪತ್ರೆಗೆ ದಾಖಲಿಸಲಾಗಿದೆ.",
        "ಸ್ಥಳೀಯ ಸವಾರರ ನೆರವಿನಿಂದ ಗಾಯಾಳು ಮಹಿಳೆಗೆ ತುರ್ತು ಚಿಕಿತ್ಸೆ ಒದಗಿಸಲಾಗಿದ್ದು, ಘಟನೆ ಸಂಬಂಧ ಕೋಟ ಆರಕ್ಷಕ ಠಾಣೆಯಲ್ಲಿ ದೂರು ದಾಖಲಾಗಿದೆ.",
        "ಗ್ರಾಮೀಣ ರಸ್ತೆಯಲ್ಲಿ ಸಂಚಾರ ನಿಯಮ ಪಾಲನೆ ಹಾಗೂ ಅಪಾಯಕಾರಿ ಹೊಂಡಗಳಿಂದ ಉಂಟಾಗುತ್ತಿರುವ ತೊಂದರೆಗಳ ಬಗ್ಗೆ ಪೊಲೀಸರು ಪರಿಶೀಲನೆ ನಡೆಸುತ್ತಿದ್ದಾರೆ."
      ],
      "takeaway": "ಗ್ರಾಮೀಣ ರಸ್ತೆಗಳ ಹೊಂಡಗಳ ಬಗ್ಗೆ ವಾಹನ ಸವಾರರು ಎಚ್ಚರ ವಹಿಸುವಂತೆ ಹಾಗೂ ಜಾಗರೂಕರಾಗಿ ಚಲಿಸುವಂತೆ ಪೊಲೀಸರು ಕೋರಿದ್ದಾರೆ.",
      "location": "ಕೋಟ",
      "sources": [
        "ಉದಯವಾಣಿ"
      ],
      "source_urls": [
        "https://udayavani.com/udupi-news/Mother-Injured-After-Falling-from-Scooter-658392?lang=kn"
      ],
      "status": "confirmed",
      "published_at": "2026-10-02T10:00:00+05:30",
      "verified_by": "Gautam Paduvari",
      "verified_at": "2026-10-02T11:36:52+0530"
    }
  ]
}
