{
  "date": "2026-08-25T09:40:00+05:30",
  "edition_no": 112,
  "strapline": "ಕರಾವಳಿ ಬುಲೆಟಿನ್",
  "stories": [
    {
      "headline": "ಕರಾವಳಿಗೆ ಆರೆಂಜ್ ಅಲರ್ಟ್: ಇಂದು ಮತ್ತು ನಾಳೆ ಭಾರಿ ಮಳೆ, ಬಿರುಗಾಳಿ ಸಾಧ್ಯತೆ",
      "category": "weather",
      "deck": "ಉಡುಪಿ ಮತ್ತು ದಕ್ಷಿಣ ಕನ್ನಡ ಜಿಲ್ಲೆಗಳಿಗೆ ಹವಾಮಾನ ಇಲಾಖೆಯಿಂದ ಎಚ್ಚರಿಕೆ ಪ್ರಕಟ.",
      "points": [
        "ಗಂಟೆಗೆ 40-50 ಕಿ.ಮೀ ವೇಗದ ಗಾಳಿ ಬೀಸುವ ಸಾಧ್ಯತೆ ಇದೆ ಎಂದು ಇಲಾಖೆ ತಿಳಿಸಿದೆ.",
        "ಮೀನುಗಾರರು ಆಗಸ್ಟ್ 27ರವರೆಗೆ ಸಮುದ್ರಕ್ಕೆ ಇಳಿಯದಂತೆ ಸೂಚನೆ ನೀಡಲಾಗಿದೆ.",
        "ತಗ್ಗು ಪ್ರದೇಶಗಳಲ್ಲಿ ನೀರು ನಿಲ್ಲುವ ಸಾಧ್ಯತೆ; ಜಿಲ್ಲಾಡಳಿತ ನಿಗಾ ಇರಿಸಿದೆ."
      ],
      "photo": {
        "path": "assets/udupi_coastal_storm.jpg",
        "nature": "representative",
        "credit": "ಊರ್ಮನಿ ಸುದ್ದಿ ಸಂಗ್ರಹ",
        "focal": [
          0.5,
          0.5
        ],
        "licence": "own"
      },
      "location": "ಉಡುಪಿ ಜಿಲ್ಲೆ",
      "dateline": "ಜಿಲ್ಲಾ ವರದಿ",
      "sources": [
        "ಭಾರತೀಯ ಹವಾಮಾನ ಇಲಾಖೆ",
        "ಉಡುಪಿ ಜಿಲ್ಲಾಡಳಿತ"
      ],
      "status": "official",
      "published_at": "2026-08-25T08:40:00+05:30",
      "takeaway": "ತುರ್ತು ಸಹಾಯಕ್ಕೆ ಜಿಲ್ಲಾ ವಿಪತ್ತು ನಿರ್ವಹಣಾ ಕೊಠಡಿ 1077 ಸಂಪರ್ಕಿಸಿ.",
      "hook": "ಕರಾವಳಿಗೆ ಆರೆಂಜ್ ಅಲರ್ಟ್"
    },
    {
      "headline": "ಬ್ರಹ್ಮಾವರ: ಹೆತ್ತವರ ಕೊಲೆ ಆರೋಪ, ಪುತ್ರ ಬಂಧನ",
      "category": "crime",
      "deck": "ಗಾಂಧಿನಗರದ ಮನೆಯಲ್ಲಿ ನಡೆದ ಘಟನೆ; ದಂಪತಿ ಸ್ಥಳದಲ್ಲೇ ಸಾವು. ಆರೋಪಿ ಪುತ್ರನನ್ನು ಕೆಲವೇ ಗಂಟೆಗಳಲ್ಲಿ ವಶಕ್ಕೆ ಪಡೆದ ಪೊಲೀಸರು.",
      "points": [
        "ಮೃತರು: ಮೆಹಬೂಬ್ ಅಲಿ (62) ಹಾಗೂ ಪತ್ನಿ ಸಂಶದ್ ಬೇಗಂ (56), ಗಾಂಧಿನಗರ ನಿವಾಸಿಗಳು.",
        "ಕೌಟುಂಬಿಕ ವಿವಾದದ ವೇಳೆ ಮಾತಿನ ಚಕಮಕಿ ತೀವ್ರಗೊಂಡು ಹಲ್ಲೆ ನಡೆದಿದೆ ಎಂದು ಪ್ರಾಥಮಿಕ ತನಿಖೆ ತಿಳಿಸಿದೆ.",
        "ಆರೋಪಿ ಪುತ್ರನನ್ನು ಬ್ರಹ್ಮಾವರ ಠಾಣಾ ಪೊಲೀಸರು ಬಂಧಿಸಿದ್ದು, ಕೊಲೆ ಪ್ರಕರಣ ದಾಖಲಾಗಿದೆ."
      ],
      "photo": {
        "path": "assets/brahmavara_crime_scene.jpg",
        "nature": "representative",
        "credit": "ಊರ್ಮನಿ ಸುದ್ದಿ ಸಂಗ್ರಹ",
        "focal": [
          0.5,
          0.46
        ],
        "licence": "own"
      },
      "location": "ಬ್ರಹ್ಮಾವರ",
      "dateline": "ಬ್ರಹ್ಮಾವರ ವರದಿ",
      "sources": [
        "ಬ್ರಹ್ಮಾವರ ಠಾಣೆ",
        "ಉಡುಪಿ ಜಿಲ್ಲಾ ಪೊಲೀಸ್"
      ],
      "status": "confirmed",
      "published_at": "2026-08-25T07:40:00+05:30"
    },
    {
      "headline": "ಈದ್ ಮಿಲಾದ್ ರಜೆ ಆಗಸ್ಟ್ 25ಕ್ಕೆ ಮರುನಿಗದಿ",
      "category": "civic",
      "deck": "ಜಿಲ್ಲಾಧಿಕಾರಿಗಳ ಪ್ರಸ್ತಾವನೆಯಂತೆ ಸರ್ಕಾರದಿಂದ ಆದೇಶ ಹೊರಡಿಸಲಾಗಿದೆ.",
      "points": [
        "ಉಡುಪಿ ಜಿಲ್ಲೆಯ ಎಲ್ಲಾ ಸರ್ಕಾರಿ ಕಚೇರಿಗಳಿಗೆ ಆಗಸ್ಟ್ 25ರಂದು ಸಾರ್ವತ್ರಿಕ ರಜೆ ಅನ್ವಯ.",
        "ಶಾಲಾ-ಕಾಲೇಜುಗಳಿಗೂ ಇದೇ ದಿನಾಂಕದಂದು ರಜೆ ಘೋಷಿಸಲಾಗಿದೆ.",
        "ಅಗತ್ಯ ಸೇವೆಗಳು ಹಾಗೂ ಆಸ್ಪತ್ರೆಗಳಿಗೆ ಈ ಆದೇಶ ಅನ್ವಯಿಸುವುದಿಲ್ಲ."
      ],
      "location": "ಉಡುಪಿ ಜಿಲ್ಲೆ",
      "dateline": "ಜಿಲ್ಲಾಡಳಿತ ವರದಿ",
      "sources": [
        "ಉಡುಪಿ ಜಿಲ್ಲಾಧಿಕಾರಿ ಕಚೇರಿ ಪ್ರಕಟಣೆ"
      ],
      "status": "official",
      "published_at": "2026-08-25T04:40:00+05:30"
    },
    {
      "headline": "ಕಸ್ತೂರ್ಬಾ ಆಸ್ಪತ್ರೆ ಆರೋಗ್ಯ ಕಾರ್ಡ್ ನೋಂದಣಿಗೆ ಆಗಸ್ಟ್ 31 ಕೊನೆ ದಿನ",
      "category": "health",
      "deck": "ಚಿಕಿತ್ಸೆ ಮತ್ತು ತಪಾಸಣೆಯಲ್ಲಿ ರಿಯಾಯಿತಿ ಪಡೆಯಲು ನೋಂದಣಿ ಅಗತ್ಯ.",
      "points": [
        "ಮಣಿಪಾಲ ಕಸ್ತೂರ್ಬಾ ಆಸ್ಪತ್ರೆಯಲ್ಲಿ ನೇರವಾಗಿ ಅಥವಾ ಆನ್‌ಲೈನ್‌ನಲ್ಲಿ ನೋಂದಣಿ ಮಾಡಬಹುದು.",
        "ಆಧಾರ್ ಕಾರ್ಡ್ ಮತ್ತು ವಿಳಾಸ ದೃಢೀಕರಣ ದಾಖಲೆ ಕಡ್ಡಾಯ."
      ],
      "photo": {
        "path": "assets/manipal_kmc_hospital.jpg",
        "nature": "representative",
        "credit": "ಊರ್ಮನಿ ಸುದ್ದಿ ಸಂಗ್ರಹ",
        "focal": [
          0.5,
          0.44
        ],
        "licence": "own"
      },
      "location": "ಮಣಿಪಾಲ",
      "dateline": "ಆರೋಗ್ಯ ವರದಿ",
      "sources": [
        "ಕಸ್ತೂರ್ಬಾ ಆಸ್ಪತ್ರೆ ಪ್ರಕಟಣೆ"
      ],
      "status": "official",
      "published_at": "2026-08-25T02:40:00+05:30"
    }
  ]
}
